title,url,address,latitude,longitude,price,info,description
"70 MARK NICHOLS Place ST. JOHN&apos;S, Newfoundland &amp; Labrador",https://www.kijiji.ca/v-apartments-condos/st-johns/70-mark-nichols-place-st-johns-newfoundland-labrador/1721693480,"MARK NICHOLS Place, ST. JOHN&apos;S, NL, A1H0A2",47.488896430716,-52.813773887336,$2500,Bedrooms: 2 *** Bathrooms: 2 *** Size (sq ft): 0 *** Pets Allowed: No *** Lease Length: Not Available,"Raised Bungelow &amp; Stunning, well cared for 2 bedroom home located on a green belted lot in sought after Southlands. Enter this home through the spacious foyer (with access to the garage) and you will ..."
"SHARING ROOMS AVAILABLE FOR BOY ,SCARBOROUGH",https://www.kijiji.ca/v-apartments-condos/st-johns/sharing-rooms-available-for-boy-scarborough/1723448318,"South Cedarbrae, Scarborough, ON, A1A",43.747783000214,-79.235209093636,$400,Bedrooms: 4 *** Bathrooms: 2.5 *** Size (sq ft): 2500 *** Pets Allowed: No *** Lease Length: one-year,Close to cedarbrae mall 3 km to centennial college Wallmart near by 15min to kennedy station All amenities near by Markham and lawrence intersection Location - Alanbury Crescent Available from sep ...
"7 Christopher Street Paradise, Newfoundland &amp; Labrador",https://www.kijiji.ca/v-apartments-condos/st-johns/7-christopher-street-paradise-newfoundland-labrador/1723372033,"Christopher Street, Paradise, NL, A1L1W6",47.527437340823,-52.88873572085,$2900,Bedrooms: 3 *** Bathrooms: 4 *** Size (sq ft): 0 *** Pets Allowed: No *** Lease Length: Not Available,Beautiful executive home on a cul-de-sac on a mature lot with greenbelt. Home features 2 in house garages on the main floor and one in the basement at rear. Exquisite 9ft. trayed ceilings throughout ...
"32 Cook Street St. John&apos;s, Newfoundland &amp; Labrador",https://www.kijiji.ca/v-apartments-condos/st-johns/32-cook-street-st-johns-newfoundland-labrador/1721508645,"Cook Street, St. John&apos;s, NL, A1C4L4",47.56466296996,-52.718074340947,$2800,Bedrooms: 3 *** Bathrooms: 4 *** Size (sq ft): 0 *** Pets Allowed: No *** Lease Length: Not Available,"Nestled on charming Cook Street, this beautifully designed fully furnished home blends historic character with modern convenience in one of St. John’s oldest neighborhoods. Spanning three ..."
"Downtown, furnished apartment for rent",https://www.kijiji.ca/v-apartments-condos/st-johns/downtown-furnished-apartment-for-rent/1723262758,"St. John&apos;s, NL A1C 2C3",47.571123548584,-52.702909695312,$1595,Bedrooms: 1 *** Bathrooms: 1 *** Size (sq ft): 750 *** Pets Allowed: No *** Lease Length: month-to-month,"Super clean, renovated apartment in a fantastic downtown location. Available from September 29 to April 30 or any 30 days therein. A 43-inch brand-new smart TV has been added. No Other costs, all ..."
Executive home near mun,https://www.kijiji.ca/v-apartments-condos/st-johns/executive-home-near-mun/1723221992,"St. John&apos;s, NL A1C 4N1",47.560974069667,-52.721134383567,$3200,Bedrooms: 4 *** Bathrooms: 3 *** Size (sq ft): 1800 *** Pets Allowed: No *** Lease Length: one-year,"New House near MUN The unit has extra large kitchen and furnished with fridge stove, microwave heat and light, washer/dryer, internet and cable etc. The house is a new construction with 9 foot ..."
Lovely 3 Bedroom House with Harbour View,https://www.kijiji.ca/v-apartments-condos/st-johns/lovely-3-bedroom-house-with-harbour-view/1723209069,"St. John&apos;s, NL A1C 2S7",47.570661286624,-52.712972170074,$2500,Bedrooms: 3 *** Bathrooms: 1 *** Size (sq ft): 1600 *** Pets Allowed: No *** Lease Length: month-to-month,"Beautifully refurbished, very comforatable fisherman&apos;s home in the Outer Battery, 15 min. walk from Downtown St. John&apos;s. Fully furnished and equipped. Lovely views. Available Oct. - May."
"$1,250  3-Bedroom House for Rent – Marystown, NL",https://www.kijiji.ca/v-apartments-condos/st-johns/1-250-3-bedroom-house-for-rent-marystown-nl/1723206448,"Marystown, NL A0E 2M0",47.186928874434,-55.141100722896,$1250,Bedrooms: 3 *** Bathrooms: 1 *** Size (sq ft): 1200 *** Pets Allowed: No *** Lease Length: one-year,"House for Rent – Marystown, NL Spacious and well-kept home available for rent in the heart of Marystown. ✅ Close to schools, grocery stores, and all amenities ✅ Safe and family-friendly neighborhood ..."
"3 Bedroom + Den, 2 Full Baths Home For Rent",https://www.kijiji.ca/v-apartments-condos/st-johns/3-bedroom-den-2-full-baths-home-for-rent/1723115875,"25 Nautilus Street, St. John&apos;s, NL",47.551796598151,-52.786960738146,$2300,Bedrooms: 3.5 *** Bathrooms: 2 *** Size (sq ft): 1800 *** Pets Allowed: No *** Lease Length: one-year,"Main Level in a two apartment home located in Kenmount Terrace, St. John&apos;s NL. Rec Room/Den and Laundry are on the Lower Level."
"condo for rent in Largo, Florida ",https://www.kijiji.ca/v-apartments-condos/st-johns/condo-for-rent-in-largo-florida/1723109619,"New Pennywell Rd, St. John&apos;s, NL A1B",47.550620717181,-52.751879606236,$2500,Bedrooms: 2 *** Bathrooms: 2 *** Size (sq ft): 1100 *** Pets Allowed: No *** Lease Length: month-to-month,"2 bedroom, 2 bathroom fully furnished condo in Largo, Florida available for rent from 01 January to 31 may, 2026. Near Indian Rocks Beach, Clearwater beach. Includes fridge, stove, dishwasher, washer ..."
Oceanfront home for rent,https://www.kijiji.ca/v-apartments-condos/st-johns/oceanfront-home-for-rent/1723095089,"Chance Cove, NL A0B 1K0",47.661321250564,-53.826244815172,$1600,Bedrooms: 2 *** Bathrooms: 1.5 *** Size (sq ft): 1200 *** Pets Allowed: No *** Lease Length: month-to-month,"Oceanfront home for rent in beautiful Chance Cove NL. Adjacent to beach and popular hiking trail. Watch whales, eagles, ospreys and fishing boats from large back deck, kitchen/dining and master ..."
Apartment for rent,https://www.kijiji.ca/v-apartments-condos/st-johns/apartment-for-rent/1723045271,"43 Wicklow Street, St. John&apos;s, NL",47.569227981181,-52.748355033225,$2000,Bedrooms: 3 *** Bathrooms: 1 *** Size (sq ft): 1200 *** Pets Allowed: No *** Lease Length: one-year,"3 bedroom apartment located in the centre of the city. Walking distance from the mall, MUN, and Hospital. Newly renovated and available immediately. $2000 POU. Parking for one vehicle and access to ..."
2 Bedroom Apartment for Rent,https://www.kijiji.ca/v-apartments-condos/st-johns/2-bedroom-apartment-for-rent/1722912336,"Conception Bay South, NL A1X 6Y2, Canada",47.491523212516,-53.025267465518,$1300,Bedrooms: 2 *** Bathrooms: 1 *** Size (sq ft): 1 *** Pets Allowed: No *** Lease Length: month-to-month,"Available immediately - New, large and spacious 2 bedroom apartment with walk-out basement, $1300/mth POU. Located in Kelligrews, close to the CBS bypass road (Peacekeeper&apos;s Way). 2-car parking, own ..."
Looking to rent,https://www.kijiji.ca/v-apartments-condos/st-johns/looking-to-rent/1719024599,"Military Rd, St. John&apos;s, A1C 2E8",47.56749569771,-52.709219873453,$1100,Bedrooms: 0 *** Bathrooms: 1 *** Size (sq ft): 600 *** Pets Allowed: Yes *** Lease Length: one-year,"Hello. I am looking for a 1 or 2 bedroom apartment, I am 29 years old currently inquiring to go back to school so ideally on a bus route. I am interested in renting asap. must be pet friendly. both ..."
House for rent,https://www.kijiji.ca/v-apartments-condos/st-johns/house-for-rent/1722775697,"St. John&apos;s, NL A1B",47.568531673,-52.776546569,$2500,Bedrooms: 3 *** Bathrooms: 2.5 *** Size (sq ft): 1100 *** Pets Allowed: No *** Lease Length: one-year,"**AVAILABLE SEPTEMBER 1st** Beautiful, spacious, 2-story family home in a calm, safe, centrally-located neighborhood with ample green space (parks, walking trails, etc.), walking distance to Torbay ..."
FABULOUS WATERFRONT HOUSE DOWNTOWN ST JOHN&apos;S,https://www.kijiji.ca/v-apartments-condos/st-johns/fabulous-waterfront-house-downtown-st-johns/1722736416,"Outer Battery Road, St. John&apos;s, NL",47.567616015471,-52.687578020938,$2800,Bedrooms: 2.5 *** Bathrooms: 2 *** Size (sq ft): 1500 *** Pets Allowed: No *** Lease Length: month-to-month,Newer waterfront home with amazing harbour and Narrows view. Fully furnished with everything. Well built for warm in winter...and has electric zone controlled heat! Less than 15 minute walk to ...
Private Acre Retreat: 4-Bed Home with Stunning Features,https://www.kijiji.ca/v-apartments-condos/st-johns/private-acre-retreat:-4-bed-home-with-stunning-features/1722664858,"121 Pine Line, Middle Cove, NL",47.641357191671,-52.706233874292,$2900,Bedrooms: 4 *** Bathrooms: 2.5 *** Size (sq ft): 4687 *** Pets Allowed: No *** Lease Length: one-year,"121 Pine Line, Logy Bay-Middle Cove-Outer Cove 4 bedrooms 2.5 bathrooms 2,900 POU Available Immediately - Lease options from 6/8 months to 1 year. Welcome to 121 Pine Line — a home full of character, ..."
31a Wicklow St. 3 Beds 1 Bath - Apartment,https://www.kijiji.ca/v-apartments-condos/st-johns/31a-wicklow-st-3-beds-1-bath-apartment/1722658795,"Wicklow Street, St. John&apos;s, NL",47.569489953028,-52.748442538483,$2500,Bedrooms: 3 *** Bathrooms: 1 *** Size (sq ft): 2000 *** Pets Allowed: No *** Lease Length: one-year,"For Rent – 31a Wicklow St. (St. John’s) Bright and modern new registed apartment. and 3-bedroom, 1-bathroom lower-level unit with living room and kitchen. ✨ Brand new – meets all municipal standards ..."
looking for 1-2 bedroom apartment,https://www.kijiji.ca/v-apartments-condos/st-johns/looking-for-1-2-bedroom-apartment/1722625937,"145 Sunrise Ave, Mount Pearl, A1N 2P6",47.51309999149,-52.817204991736,$1100,Bedrooms: 2 *** Bathrooms: 1 *** Size (sq ft): 1200 *** Pets Allowed: Yes *** Lease Length: one-year,"Looking for a 1- 2bedroom apartment for rent , must be dog friendly &amp; cat friendly &amp; needs a fenced in backyard can pay from 850 to 1100 a month rent pou is fine , looking for somewhere quiet to ..."
apartment of rent,https://www.kijiji.ca/v-apartments-condos/st-johns/apartment-of-rent/1722566256,"Mount Pearl, NL A1N 1A1",47.519485409148,-52.779239664217,$1300,Bedrooms: 1 *** Bathrooms: 1 *** Size (sq ft): 698 *** Pets Allowed: No *** Lease Length: month-to-month,1 bedroom apt with utilities included on quiet cul-du- sac close to all amenities
$1500 - 2 Bed/1 Bath Apartment. HEAT &amp; ELECTRIC INCLUDED,https://www.kijiji.ca/v-apartments-condos/st-johns/1500-2-bed-1-bath-apartment-heat-electric-included/1718260680,"Topsail Road, Mount Pearl, NL",47.523294098134,-52.77644822733,$1500,Bedrooms: 2 *** Bathrooms: 1 *** Size (sq ft): 1 *** Pets Allowed: No *** Lease Length: one-year,"Heat and Electric included: Private, naturally well-lit 2-bedroom 1 bathroom apartment in professional business park on Topsail Road. Close to bus route and less than 1.5 km to grocery stores. ..."
Home for rent,https://www.kijiji.ca/v-apartments-condos/st-johns/home-for-rent/1722383440,"Bonavista, NL A0C 1B0",48.6577957,-53.1122212,$1400,Bedrooms: 3.5 *** Bathrooms: 1 *** Size (sq ft): 1200 *** Pets Allowed: No *** Lease Length: month-to-month,"Off season home rental available September 1,2025 to June 30 2026. Fully furnished, 3 BR, 1 B home situated on the coast of the north Atlantic in the picturesque town of Bonavista NL. House is ..."
3 bedroom Apartment for rent,https://www.kijiji.ca/v-apartments-condos/st-johns/3-bedroom-apartment-for-rent/1722342208,"Wicklow Street, St. John&apos;s, NL",47.569489953028,-52.748442538483,$1680,Bedrooms: 3 *** Bathrooms: 1 *** Size (sq ft): 1000 *** Pets Allowed: No *** Lease Length: one-year,"Hello, 3 bedroom for rent in St John&apos;s Near MUN/HSC. Apartment is bright, next to all amenities like bus stop, groceries, banks. Very close HSC/MUN. Close to Avalon Mall Furnished with Bed, Desk and ..."
House For Rent,https://www.kijiji.ca/v-apartments-condos/st-johns/house-for-rent/1722313354,"Holyrood, NL A0A 2R0",47.345126358487,-53.142951397757,$2500,Bedrooms: 3 *** Bathrooms: 3 *** Size (sq ft): 2500 *** Pets Allowed: No *** Lease Length: month-to-month,"Fully furnished house for rent in HOLYROOD, NL. 3 ensuite bedroom, full kitchen, living/dining room, utilitiy/storage rooms/ overlooking Holyrood harbour. Super outside deck, BBQ, Pay by month, ..."
"House for Rent in Jackson’s  Arm, Nl",https://www.kijiji.ca/v-apartments-condos/st-johns/house-for-rent-in-jackson-s-arm-nl/1722276802,"St. John&apos;s, NL, A0A 1J0",47.498763877665,-52.70210913974,$1200,Bedrooms: 4 *** Bathrooms: 1.5 *** Size (sq ft): 1200 *** Pets Allowed: No *** Lease Length: month-to-month,"4 Bedroom, 1.5 Bath available in Jackson Arm, Nl. 1 hr and 20 min from Deer Lake, Nl. Beautiful Water View. Must have References. Can be Furnished or Unfurnished. Rent is $1200 per month. Damage ..."
Fully Furnished and Equipped 2 Bedroom House in Torbay,https://www.kijiji.ca/v-apartments-condos/st-johns/fully-furnished-and-equipped-2-bedroom-house-in-torbay/1722225599,"Torbay, NL A1K 1G6",47.664163051017,-52.731434066189,$2200,Bedrooms: 2.5 *** Bathrooms: 2.5 *** Size (sq ft): 1240 *** Pets Allowed: No *** Lease Length: one-year,"Available January 7, 2026, a fully furnished and equipped two-story detached saltbox house located in Torbay, approximately 20 minutes from the Health Sciences Complex, Downtown St. John’s, and ..."
Looking for Room for Rent ,https://www.kijiji.ca/v-apartments-condos/st-johns/looking-for-room-for-rent/1722178350,"Conception Bay South, NL, A1W 3B1",47.518621528297,-52.96552327134,$900,Bedrooms: 1 *** Bathrooms: 1 *** Size (sq ft): 1 *** Pets Allowed: Yes *** Lease Length: one-year,I am a 42 year old single girl looking for a quiet space to live. Please contact me at 7096313304 Or message me!
Apartment for rent,https://www.kijiji.ca/v-apartments-condos/st-johns/apartment-for-rent/1722109806,"Torbay, NL A1K 0E9",47.656976826329,-52.752080118634,$1250,Bedrooms: 2 *** Bathrooms: 1 *** Size (sq ft): 800 *** Pets Allowed: No *** Lease Length: month-to-month,2 bedroom apartment now available located in a quiet culdac.$1250 a month p.o.u.no smoking or no pets. please call 709&apos;689-4128
1 Bedroom above Ground apt on Three Island Pond,https://www.kijiji.ca/v-apartments-condos/st-johns/1-bedroom-above-ground-apt-on-three-island-pond/1722059835,"St. John&apos;s, NL A1G 1V9",47.511973254155,-52.758137803878,$1600,Bedrooms: 1 *** Bathrooms: 1 *** Size (sq ft): 750 *** Pets Allowed: No *** Lease Length: one-year,"One-Bedroom Apartment for Rent – Three Island Pond Bright, above-ground one-bedroom apartment with pond access, located on beautiful Three Island Pond. Ideal for a mature, responsible individual ..."
looking for place to rent downtown,https://www.kijiji.ca/v-apartments-condos/st-johns/looking-for-place-to-rent-downtown/1722047272,"332 Duckworth St, St. John&apos;s, A1C 1G9",47.564031117393,-52.708382575171,$1400,Bedrooms: 0 *** Bathrooms: 1 *** Size (sq ft): 500 *** Pets Allowed: No *** Lease Length: one-year,Hi there I am a responsible 26 year old hard working individual who was in desperate need of a lifestyle change so I moved to NL. I am currently seeking a place to rent that is fully all inclusive ...
House for rent,https://www.kijiji.ca/v-apartments-condos/st-johns/house-for-rent/1722014464,"Groves Rd, St. John&apos;s, NL A1B",47.56405117791,-52.760330972542,$2000,Bedrooms: 2 *** Bathrooms: 1 *** Size (sq ft): 1 *** Pets Allowed: No *** Lease Length: one-year,"Welcome to 105 Groves Rd- charming 2-bedroom home with numerous upgrades throughout. The property features a beautifully renovated kitchen and bathroom, updated windows, newly built front and back ..."
2 BDRM Basement Apartment for Rent in Paradise,https://www.kijiji.ca/v-apartments-condos/st-johns/2-bdrm-basement-apartment-for-rent-in-paradise/1721956975,"1808 Topsail Road, Paradise, NL",47.528201414984,-52.892655028446,$1200,Bedrooms: 2 *** Bathrooms: 1 *** Size (sq ft): 700 *** Pets Allowed: No *** Lease Length: one-year,"2 Bedroom basement apartment in Paradise, available Oct. 1st. $1200/month POU. 1 year lease required. Text (902) 225-4591 for more information."
"Executive, modern fully furnished condo for rent.",https://www.kijiji.ca/v-apartments-condos/st-johns/executive-modern-fully-furnished-condo-for-rent/1721860752,"St. John&apos;s, NL A1B 1R9",47.581230992256,-52.715712298041,$3500,Bedrooms: 2 *** Bathrooms: 1 *** Size (sq ft): 1140 *** Pets Allowed: No *** Lease Length: month-to-month,"Modern 2 bedroom, 1 bathroom condo. Fully furnished. Located in Elizabeth towers. Balcony. Month to month."
Looking for Mature Working Indivdual to Share a House ,https://www.kijiji.ca/v-room-rental-roommate/st-johns/looking-for-mature-working-indivdual-to-share-a-house/1725642419,"Paradise, NL, A1L 1R3",47.530849719202,-52.864493845433,$1400,,"Private bedroom, full bathroom, separate family room! Beautiful spacious kitchen. Parking for 1 car. Rent includes everything, including heat and light and TV and Internet! Bright beautiful home. ..."
ENTREPRENEUR - For rent for home-based business opportunity.,https://www.kijiji.ca/v-commercial-office-space/st-johns/entrepreneur-for-rent-for-home-based-business-opportunity/1724866368,"St. John&apos;s, NL A1A 4W8",47.600913125836,-52.738255929546,$1500,Size (sq ft): 1936,"Address: 477A, Main Street North, Glovertown, A0G 2L0 Appliances included Located in scenic Glovertown, this well-maintained bungalow is situated on a hillside with a fabulous view of Alexander Bay – ..."
"180 Water Street Carbonear, Newfoundland &amp; Labrador",https://www.kijiji.ca/v-commercial-office-space/st-johns/180-water-street-carbonear-newfoundland-labrador/1715680274,"Water Street, Carbonear, NL, A1Y1B1",47.741246040338,-53.205466306644,$3400,,"This is a unique opportunity where you can actually live above your business! 180 Water Street - Commercial Features: Licensed until next year - including upstairs, down stairs, front &amp; back patios | ..."
Furnished room in a 4 bedrooms house,https://www.kijiji.ca/v-room-rental-roommate/st-johns/furnished-room-in-a-4-bedrooms-house/1725597121,"Hamlet Street, St. John&apos;s, A1B 0L1",47.549935983822,-52.787493228908,$730,Pets Allowed: No,"A fully furnished room in a furnished three-bedroom house located in Hamlet Street is available for rent. Location: • 2 minutes walk to the bus station • Walking distance to Walmart, Sobeys, ..."
Rooms available in Beautiful Guest House in Downtown St. John&apos;s,https://www.kijiji.ca/v-room-rental-roommate/st-johns/rooms-available-in-beautiful-guest-house-in-downtown-st-johns/1724137513,"21 Military Road, St. John&apos;s, NL",47.57118100653,-52.703223010853,$1000,Pets Allowed: No,"We have a few rooms for long term and short term rental available in our Guest House. Rooms include high speed internet, heat, light and power, Cable TV and the rooms are completely furnished. large ..."
✨ Rooms for Rent - Girls Only ✨,https://www.kijiji.ca/v-room-rental-roommate/st-johns/rooms-for-rent-girls-only/1725574689,"Old Pennywell Road, St. John&apos;s, NL, A1B 4L6",47.555630214152,-52.742751294114,$650,,We have 3 private rooms available in a spacious 4BHK upper-level unit • Just a 5-minute walk to Avalon Mall - super convenient!  Rent: $650/month + utilities 1-year lease required (starting next ...
Room for rent,https://www.kijiji.ca/v-room-rental-roommate/st-johns/room-for-rent/1725567506,"Eastaff St, St. John&apos;s, NL A1E 2J4",47.538854758506,-52.748310590282,$800,,"✨ Bright, Clean Room for Rent – Ideal for Student, female only (Near Anspach St.) ✨There are two females living here. Looking for a quiet, responsible student to share a cozy and welcoming home near ..."
Unfurnished extra large Room for Rent,https://www.kijiji.ca/v-room-rental-roommate/st-johns/unfurnished-extra-large-room-for-rent/1725563060,"Torbay, NL, A1K 1G4",47.641992120837,-52.779605031377,$1000,Pets Allowed: No,"Unfurnished extra large room for rent with walk in closet. Own full bath next to room. Heat and light, and WiFi Internet included. Shared kitchen and laundry. not on bus route would need vechile to ..."
"187 Gower Street St. John&apos;s, Newfoundland &amp; Labrador",https://www.kijiji.ca/v-commercial-office-space/st-johns/187-gower-street-st-johns-newfoundland-labrador/1715614903,"Gower Street, St. John&apos;s, NL, A1C1R2",47.565069027438,-52.709065993861,$18,,"Welcome to Victoria Hall in St. John&apos;s, a distinguished historic building with immense potential. Currently utilized as offices, this architectural gem offers a unique opportunity for transformation ..."
Seeking Roommate,https://www.kijiji.ca/v-room-rental-roommate/st-johns/seeking-roommate/1725533035,"New Gower Street, St. John&apos;s, NL",47.556743276821,-52.714642232345,$800,Pets Allowed: No,43 m seeks roommate. Open to whatever mostly people-wise. No hard drugs or drunken nonsense. 420 friendly(: I keep a normal schedule mostly but i don&apos;t work other than part-time here and there. Be ...
"Room for rent: furnished, free internet, off street parking",https://www.kijiji.ca/v-room-rental-roommate/st-johns/room-for-rent:-furnished-free-internet-off-street-parking/1725522057,"17 Rotary Drive, St. John&apos;s, NL",47.549983005761,-52.750271974481,$630,,A large and bright bedroom in a 5-bedroom apartment with two bathrooms. Available for immediate occupancy. • Rent: $630/month for a fixed term lease of 6-12 months • High-speed internet included • ...
room for rent,https://www.kijiji.ca/v-room-rental-roommate/st-johns/room-for-rent/1725507825,"Watson Crescent, St. John&apos;s, NL A1A 3K3",47.598683503609,-52.686123054642,$750,,"Available Oct 16. fully furnished private room is available in a clean and well-maintained home in the quiet neighborhood of Virginia Park, in the east end of St. John’s. The home is shared with one ..."
Room for Rent from Oct 1st - Oct 30th,https://www.kijiji.ca/v-short-term-rental/st-johns/room-for-rent-from-oct-1st-oct-30th/1725491808,"St. John&apos;s, NL, A1B 3P5",47.568531673,-52.776546569,$525,Bathrooms: 2,"Short-Term Room Rental Near MUN – October Only ($525 all inclusive) Available: Oct 1 – Oct 29 (1 month only) ️ Fully furnished room, move-in ready ‍♂️ 15 min walk to MUN, 5–7 min walk to bus routes 2 ..."
"219 New Gower Street St. John&apos;s, Newfoundland &amp; Labrador",https://www.kijiji.ca/v-commercial-office-space/st-johns/219-new-gower-street-st-johns-newfoundland-labrador/1725488502,"New Gower Street, St. John&apos;s, NL, A1E1B1",47.556743276821,-52.714642232345,$5900,,"5,800 sf turn-key office space available for short or long term lease in the former &quot;Superior Office&quot; building situated in Downtown St. John&apos;s Business and Entertainment district. Extensively ..."
Master bedroom with 3-piece ensuite for rent,https://www.kijiji.ca/v-room-rental-roommate/st-johns/master-bedroom-with-3-piece-ensuite-for-rent/1725481897,"St. John&apos;s, NL A1E 0B9",47.548602296761,-52.753556507059,$720,Pets Allowed: No,Large and bright master bedroom with a 3-piece ensuite bathroom for your own use. Located in a 5-bedroom apartment with two bathrooms. Available for immediate occupancy. • Rent: $720/month for a ...
Furnished Room in Shared 4-Bedroom House (All Inclusive),https://www.kijiji.ca/v-room-rental-roommate/st-johns/furnished-room-in-shared-4-bedroom-house-all-inclusive/1725479425,"279 Elizabeth Avenue, St. John&apos;s, NL",47.568453996241,-52.733942015438,$700,Pets Allowed: No,"One Large Bedroom for Rent in Fully Furnished 4-Bedroom Apartment | Across from MUN – Available September 2025 to December 31, 2025 (All Inclusive) Prime Location – Directly Across from MUN (The ..."
"40 Aberdeen Avenue Unit#106 St. John’s, Newfoundland &amp; Labrador",https://www.kijiji.ca/v-commercial-office-space/st-johns/40-aberdeen-avenue-unit-106-st-john-s-newfoundland-labrador/1723141724,"Aberdeen Avenue Unit#106, St. John’s, NL, A1A5T3",47.617158721023,-52.714143624862,$25,,"Executive office space, partly furnished located in a high traffic east end shopping area. Store front visibility with entrance on the side. Lease is for $25.00 per square foot plus operating ..."
Room Vacant,https://www.kijiji.ca/v-room-rental-roommate/st-johns/room-vacant/1720140406,"29 Guy Street, St. John&apos;s, NL",47.565960002861,-52.733478999107,$550,Pets Allowed: No,"looking for the students of one of my rooms (fully furnished)including the bed, furniture, kitchen accessories and parking spot also. $550 +pou (Near to MUN)"
"100 Brookfield Road Unit#A St. John&apos;s, Newfoundland &amp; Labrador",https://www.kijiji.ca/v-commercial-office-space/st-johns/100-brookfield-road-unit-a-st-johns-newfoundland-labrador/1721260499,"Brookfield Road Unit#A, St. John&apos;s, NL, A1E3T9",47.52168838285,-52.765117163195,$20,,"High visibility retail store front space available in sought after St. John&apos;s west plaza. Located on Brookfield road one of the main thoroughfares between St. John&apos;s and Mount Pearl, and just seconds ..."
"151 Crosbie Road Unit#101 St. John&apos;s, Newfoundland &amp; Labrador",https://www.kijiji.ca/v-commercial-office-space/st-johns/151-crosbie-road-unit-101-st-johns-newfoundland-labrador/1721199790,"Crosbie Road Unit#101, St. John&apos;s, NL, A1B4B4",47.561067066882,-52.745155074049,$18,,"151 Crosbie Rd is a centrally located, high exposure building with tons of recent upgrades (all new HVAC units, all new windows and doors, new exterior facade, and new roof)! On the corner of ..."
"1682b Topsail Road Paradise, Newfoundland &amp; Labrador",https://www.kijiji.ca/v-commercial-office-space/st-johns/1682b-topsail-road-paradise-newfoundland-labrador/1722960871,"Topsail Road, Paradise, NL, A1L1V8",47.5296760013,-52.90262295534,$1000,,"This is a very high traffic area with lots of vehicular and walking traffic. It offers lots of visibilty for your business. The space includes a large open concept front office, a private rear ..."
