title,url,address,latitude,longitude,price,info,description
"1B Merchant Drive Unit#200 Carbonear, Newfoundland &amp; Labrador",https://www.kijiji.ca/v-commercial-office-space/st-johns/1b-merchant-drive-unit-200-carbonear-newfoundland-labrador/1714722509,"Merchant Drive Unit#200, Carbonear, NL, A1Y1A6",47.780251446078,-53.235243443975,$23,,"Existing Business owners, young entrepreneurs, take a peek at this great opportunity to operate your business in a high profile area of Carbonear. This space consists of 1800 square feet of open area ..."
"19 Old Placentia Road Unit#201 Mount Pearl, Newfoundland &amp; Labra",https://www.kijiji.ca/v-commercial-office-space/st-johns/19-old-placentia-road-unit-201-mount-pearl-newfoundland-labra/1714721996,"Old Placentia Road Unit#201, Mount Pearl, NL, A1N4P4",47.513728634228,-52.831258342057,$1450,,"1400 sq ft of prime 2nd floor office space for only $1450/mo plus HST with heat, air conditioning, snow clearing included. Here&apos;s 6 offices plus a lunch room and a bathroom. There are 5 dedicated ..."
"626 Southside Road St. John&apos;s, Newfoundland &amp; Labrador",https://www.kijiji.ca/v-commercial-office-space/st-johns/626-southside-road-st-johns-newfoundland-labrador/1714721890,"Southside Road, St. John&apos;s, NL, A1E1A5",47.538476529914,-52.729696562746,$3000,,Iconic location in St.John&apos;s. This location was Noseworthy&apos;s Family Grocery for 60+ years on the &quot;Southside&quot;. Excellent set up to open the shop again. All equipment is in place including walk-in ...
"11 Austin Street Unit#203 St John&apos;s, Newfoundland &amp; Labrador",https://www.kijiji.ca/v-commercial-office-space/st-johns/11-austin-street-unit-203-st-johns-newfoundland-labrador/1714721908,"Austin Street Unit#203, St John&apos;s, NL, A1B4C1",47.560855884832,-52.769685970978,$1300,,"For Lease, September 1 ,2025 approx. 700 Sq Ft affordable second floor office space located in a prime location off Kenmount Road. There are four offices and a common area. The rent includes business ..."
Fully Furnished Room 5 Walking Distance from Mun,https://www.kijiji.ca/v-room-rental-roommate/st-johns/fully-furnished-room-5-walking-distance-from-mun/1724622828,"Bonaventure Avenue, St. John&apos;s, NL",47.568991225714,-52.715338643679,$700,Pets Allowed: No,"Looking for clean, comfortable, and convenient place to live near Memorial University? Look no further! ✅ Location: Just a 5-minute walk to MUN - Perfect for student of university staff. ✅Furnished: ..."
Beautiful Home for Rent in Largo Florida - Four Seasons Estates,https://www.kijiji.ca/v-short-term-rental/st-johns/beautiful-home-for-rent-in-largo-florida-four-seasons-estates/1724581562,"Waterford Bridge Rd, St. John&apos;s, A1E 1C5",47.54545714451,-52.72222254965,$2250,Bedrooms: 2 *** Bathrooms: 2 *** Pets Allowed: No,"Beautiful 2 bedroom 2 bathroom home for Rent in Four Seasons Estates, Largo, Florida. 1032 square feet of open concept living space. Fully furnished - includes on site washer/dryer, linens, kitchen ..."
"235 Pouch Cove Highway Flatrock, Newfoundland &amp; Labrador",https://www.kijiji.ca/v-commercial-office-space/st-johns/235-pouch-cove-highway-flatrock-newfoundland-labrador/1718556648,"Pouch Cove Highway, Flatrock, NL, A1K1C9",47.720484198101,-52.729586506655,$25,,"Commercial property for lease. 8,000 square feet of commercial space demisable as three separate units. Just 10 minutes outside of St. John’s. Asking $25/PSF gross with equipment negotiable. Building ..."
"12 GLENEYRE Street Unit#304A ST. JOHN&apos;S, Newfoundland &amp; Labrador",https://www.kijiji.ca/v-commercial-office-space/st-johns/12-gleneyre-street-unit-304a-st-johns-newfoundland-labrador/1722299166,"GLENEYRE Street Unit#304A, ST. JOHN&apos;S, NL, A1A2M7",47.601660791599,-52.713348433708,$18,,"Excellent location on the corner of Torbay Road and Gleneyre Street(Wedgewood Park area). High profile location in the east end of St. John&apos;s. Third floor suite with waiting area, storage, offices ..."
"120 Torbay Road St. John&apos;s, Newfoundland &amp; Labrador",https://www.kijiji.ca/v-commercial-office-space/st-johns/120-torbay-road-st-johns-newfoundland-labrador/1716592835,"Torbay Road, St. John&apos;s, NL, A1B2G8",47.591702336255,-52.725511497224,$18,,"Discover an exceptional opportunity to lease office space in the Prince Charles Building - located at 120 Torbay Rd in the thriving East End! Only two office suites remaining at 1,120sqft and ..."
"6-10 Lambes Lane St. John&apos;s, Newfoundland &amp; Labrador",https://www.kijiji.ca/v-commercial-office-space/st-johns/6-10-lambes-lane-st-johns-newfoundland-labrador/1718495217,"Lambes Lane, St. John&apos;s, NL, A1B4E9",47.568629880352,-52.735633040278,$614,,Welcome home to Wester-Land! St. John&apos;s newest &amp; most exciting student accommodations. Enjoy the convenience of living across the street from the MUN campus and the independence that comes with ...
"6-10 Lambes Lane St. John&apos;s, Newfoundland &amp; Labrador",https://www.kijiji.ca/v-commercial-office-space/st-johns/6-10-lambes-lane-st-johns-newfoundland-labrador/1718495219,"Lambes Lane, St. John&apos;s, NL, A1B4E9",47.568629880352,-52.735633040278,$3070,,Welcome home to Wester-Land! St. John&apos;s newest &amp; most exciting student accommodations. Enjoy the convenience of living across the street from the MUN campus and the independence that comes with ...
"6-10 Lambes Lane St. John&apos;s, Newfoundland &amp; Labrador",https://www.kijiji.ca/v-commercial-office-space/st-johns/6-10-lambes-lane-st-johns-newfoundland-labrador/1718495214,"Lambes Lane, St. John&apos;s, NL, A1B4E9",47.568629880352,-52.735633040278,$725,,Welcome home to Wester-Land! St. John&apos;s newest &amp; most exciting student accommodations. Enjoy the convenience of living across the street from the MUN campus and the independence that comes with ...
"6-10 Lambes Lane St. John&apos;s, Newfoundland &amp; Labrador",https://www.kijiji.ca/v-commercial-office-space/st-johns/6-10-lambes-lane-st-johns-newfoundland-labrador/1718495215,"Lambes Lane, St. John&apos;s, NL, A1B4E9",47.568629880352,-52.735633040278,$2900,,Welcome home to Wester-Land! St. John&apos;s newest &amp; most exciting student accommodations. Enjoy the convenience of living across the street from the MUN campus and the independence that comes with ...
"6-10 Lambes Lane St. John&apos;s, Newfoundland &amp; Labrador",https://www.kijiji.ca/v-commercial-office-space/st-johns/6-10-lambes-lane-st-johns-newfoundland-labrador/1718495216,"Lambes Lane, St. John&apos;s, NL, A1B4E9",47.568629880352,-52.735633040278,$2385,,Welcome home to Wester-Land! St. John&apos;s newest &amp; most exciting student accommodations. Enjoy the convenience of living across the street from the MUN campus and the independence that comes with ...
"6-10 Lambes Lane St. John&apos;s, Newfoundland &amp; Labrador",https://www.kijiji.ca/v-commercial-office-space/st-johns/6-10-lambes-lane-st-johns-newfoundland-labrador/1718495220,"Lambes Lane, St. John&apos;s, NL, A1B4E9",47.568629880352,-52.735633040278,$795,,Welcome home to Wester-Land! St. John&apos;s newest &amp; most exciting student accommodations. Enjoy the convenience of living across the street from the MUN campus and the independence that comes with ...
Bachelor Pad,https://www.kijiji.ca/v-short-term-rental/st-johns/bachelor-pad/1724196078,"Mount Pearl, NL A1N 1W9",47.513476171304,-52.802512940393,$600,Bathrooms: 1 *** Pets Allowed: No,"Bachelor Pad ...Available one room with fridge &amp; microwave, close to all amenities. Own entrance, bathroom, and parking. Owner occupied home, on bus route in Mt. Pearl. Suitable for a mature non ..."
"710 Torbay Road St. John&apos;s, Newfoundland &amp; Labrador",https://www.kijiji.ca/v-commercial-office-space/st-johns/710-torbay-road-st-johns-newfoundland-labrador/1699768327,"Torbay Road, St. John&apos;s, NL, A1A5G9",47.62196750391,-52.723716352797,$19,,"Prime 5,908 SQ FT retail/warehouse space at 710 Torbay Road, ready for immediate occupancy. Perfectly positioned with access from White Rose Drive, it&apos;s just minutes away from St. John&apos;s ..."
"24 Stavanger Drive St. John&apos;s, Newfoundland &amp; Labrador",https://www.kijiji.ca/v-commercial-office-space/st-johns/24-stavanger-drive-st-johns-newfoundland-labrador/1699768269,"Stavanger Drive, St. John&apos;s, NL, A1A5E8",47.617275019929,-52.715456566175,$19,,"Prime commercial space is now available at 24 Stavanger Drive, offering a versatile mix of retail and warehouse options. This property features a spacious layout, ideal for businesses seeking a ..."
"28 Stavanger Drive St. John&apos;s, Newfoundland &amp; Labrador",https://www.kijiji.ca/v-commercial-office-space/st-johns/28-stavanger-drive-st-johns-newfoundland-labrador/1699768281,"Stavanger Drive, St. John&apos;s, NL, A1A5E8",47.617275019929,-52.715456566175,$19,,"Commercial mix – retail/warehouse space available at 28 Stavanger Drive with ample parking on site. Stavanger Drive offers quick and easy access to TCH, and is also surrounded by retail and ..."
"136 Crosbie Road Unit#Suite 309 St. John&apos;s, Newfoundland &amp; Labra",https://www.kijiji.ca/v-commercial-office-space/st-johns/136-crosbie-road-unit-suite-309-st-johns-newfoundland-labra/1699763945,"Crosbie Road Unit#Suite 309, St. John&apos;s, NL, A1B3K3",47.560721061919,-52.743673991758,$14,,Welcome to the &quot;Viking Building&quot;. We have availability to suit almost any need. Centrally located this office is easily accessible from Columbus Drive allowing clients or employees to flow in from ...
"136 Crosbie Road Unit#Suite 304 St. John&apos;s, Newfoundland &amp; Labra",https://www.kijiji.ca/v-commercial-office-space/st-johns/136-crosbie-road-unit-suite-304-st-johns-newfoundland-labra/1699763741,"Crosbie Road Unit#Suite 304, St. John&apos;s, NL, A1B3K3",47.560721061919,-52.743673991758,$14,,Welcome to the &quot;Viking Building&quot;. We have availability to suit almost any need. Centrally located this office is easily accessible from Columbus Drive allowing clients or employees to flow in from ...
"39 Hallett Crescent St. John&apos;s, Newfoundland &amp; Labrador",https://www.kijiji.ca/v-commercial-office-space/st-johns/39-hallett-crescent-st-johns-newfoundland-labrador/1699763776,"Hallett Crescent, St. John&apos;s, NL, A1B4C4",47.562472425505,-52.767977821643,$14,,"Commercial property in a prime area! This property boasts both office and warehouse space, and is perfect for businesses looking for a central location with ample parking. The space is approximately ..."
"136 Crosbie Road Unit#307 St. John&apos;s, Newfoundland &amp; Labrador",https://www.kijiji.ca/v-commercial-office-space/st-johns/136-crosbie-road-unit-307-st-johns-newfoundland-labrador/1699763777,"Crosbie Road Unit#307, St. John&apos;s, NL, A1B3K3",47.560721061919,-52.743673991758,$14,,Welcome to the &quot;Viking Building&quot;. We have availability to suit almost any need. Centrally located this office is easily accessible from Columbus Drive allowing clients or employees to flow in from ...
"136 Crosbie Road Unit#203 St John&apos;s, Newfoundland &amp; Labrador",https://www.kijiji.ca/v-commercial-office-space/st-johns/136-crosbie-road-unit-203-st-johns-newfoundland-labrador/1699763782,"Crosbie Road Unit#203, St John&apos;s, NL, A1B3K3",47.560721061919,-52.743673991758,$14,,"On the second floor of this commercial area, you&apos;ll find a versatile space with multiple rooms. Each room is thoughtfully designed to cater to different needs and businesses. One room could be a ..."
"136 Crosbie Road Unit#Suite 400 St. John&apos;s, Newfoundland &amp; Labra",https://www.kijiji.ca/v-commercial-office-space/st-johns/136-crosbie-road-unit-suite-400-st-johns-newfoundland-labra/1699763735,"Crosbie Road Unit#Suite 400, St. John&apos;s, NL, A1B3K3",47.560721061919,-52.743673991758,$14,,Welcome to the &quot;Viking Building&quot;. We have availability to suit almost any need. Centrally located this office is easily accessible from Columbus Drive allowing clients or employees to flow in from ...
"136 Crosbie Road Unit#Suite 301 St. John&apos;s, Newfoundland &amp; Labra",https://www.kijiji.ca/v-commercial-office-space/st-johns/136-crosbie-road-unit-suite-301-st-johns-newfoundland-labra/1699763722,"Crosbie Road Unit#Suite 301, St. John&apos;s, NL, A1B3K3",47.560721061919,-52.743673991758,$14,,Welcome to the &quot;Viking Building&quot;. We have availability to suit almost any need. Centrally located this office is easily accessible from Columbus Drive allowing clients or employees to flow in from ...
"370 Torbay Road St. John&apos;s, Newfoundland &amp; Labrador",https://www.kijiji.ca/v-commercial-office-space/st-johns/370-torbay-road-st-johns-newfoundland-labrador/1699763733,"Torbay Road, St. John&apos;s, NL, A1A3W8",47.600469767688,-52.712612291391,$17,,Discover an exceptional opportunity to lease office space in Bally Rou Place - located at 370 Torbay Rd in the thriving East End! This building has excellent visibility and easy access to both uptown ...
"1 Whitbourne Avenue Unit#A Whitbourne, Newfoundland &amp; Labrador",https://www.kijiji.ca/v-commercial-office-space/st-johns/1-whitbourne-avenue-unit-a-whitbourne-newfoundland-labrador/1720319605,"Whitbourne Avenue Unit#A, Whitbourne, NL, A0B3K0",47.424843705923,-53.5744785115,$1100,,"This office space is located in the lower level of a commercial building, and offers 775 sq ft of space including a reception area, two offices, kitchen and bathroom. The space is suitable for retail ..."
"180 Hamilton Avenue St. John&apos;s, Newfoundland &amp; Labrador",https://www.kijiji.ca/v-commercial-office-space/st-johns/180-hamilton-avenue-st-johns-newfoundland-labrador/1720319310,"Hamilton Avenue, St. John&apos;s, NL, A1E1J5",47.552186591777,-52.722740130251,$2500,,"Excellent Commercial Lease Opportunity – This centrally located property offers an outstanding leasing option for businesses seeking visibility, flexibility, and convenience in the heart of St. ..."
"1027 Topsail Road Unit#302 Mount Pearl, Newfoundland &amp; Labrador",https://www.kijiji.ca/v-commercial-office-space/st-johns/1027-topsail-road-unit-302-mount-pearl-newfoundland-labrador/1718428577,"Topsail Road Unit#302, Mount Pearl, NL, A1N5K3",47.52467845917,-52.811049824958,$29,,"Unit 302 on the 3rd floor is ready for lease in this architecturally striking and modern building—ideal for a wide range of professional office uses. The lease rate includes all common area expenses, ..."
1 Bedroom Student Apartment for Rent Right Beside MUN!,https://www.kijiji.ca/v-room-rental-roommate/st-johns/1-bedroom-student-apartment-for-rent-right-beside-mun/1717002796,"Rodney St, St. John&apos;s, NL A1B 3B4",47.571343703612,-52.727653340348,$795,Pets Allowed: No,Hi! I&apos;m looking for a roommate to share this brand new 3-bedroom apartment which is right beside MUN. $795/month + POU (Utilities split) per person. The apartment is fully furnished and move-in ...
Room for Rent,https://www.kijiji.ca/v-room-rental-roommate/st-johns/room-for-rent/1724169325,"St. John&apos;s, NL, A1B 3P5",47.568531673,-52.776546569,$525,,"Short-Term Room Rental Near MUN – October Only ($525 all inclusive) Available: Oct 1 – Oct 29 (1 month only) ️ Fully furnished room, move-in ready ‍♂️ 15 min walk to MUN, 5–7 min walk to bus routes 2 ..."
Flexible Office Space,https://www.kijiji.ca/v-commercial-office-space/st-johns/flexible-office-space/1723896612,"Mount Pearl, NL A1N 1W1",47.518034962713,-52.804669687899,$450,Size (sq ft): 120,"Office space is available in this high visibility and convenient central location in Mt. Pearl. The offices are clean, bright, with hard wood floors, individual control for a mini-split ..."
"14 International Place Unit#203 St. John&apos;s, Newfoundland &amp; Labra",https://www.kijiji.ca/v-commercial-office-space/st-johns/14-international-place-unit-203-st-johns-newfoundland-labra/1718367920,"International Place Unit#203, St. John&apos;s, NL, A1A0L4",47.603646674009,-52.732547099112,$18,,"Individual offices and cubicle workstations are available at 14 International Place, St. John&apos;s, NL, starting at $500 per month for cubicles and $600-1000 for offices, depending on size, plus ..."
"136 Crosbie Road Unit#403 St John&apos;s, Newfoundland &amp; Labrador",https://www.kijiji.ca/v-commercial-office-space/st-johns/136-crosbie-road-unit-403-st-johns-newfoundland-labrador/1699682639,"Crosbie Road Unit#403, St John&apos;s, NL, A1B3K3",47.560721061919,-52.743673991758,$14,,"Location, Location, Location. Welcome to the &quot;Viking Building&quot;. Seize this rare opportunity to establish your business in one of the most sought-after commercial zones. This space has multiple ..."
"1171 Topsail Road Mount Pearl, Newfoundland &amp; Labrador",https://www.kijiji.ca/v-commercial-office-space/st-johns/1171-topsail-road-mount-pearl-newfoundland-labrador/1720256882,"Topsail Road, Mount Pearl, NL, A1N5G2",47.527913884437,-52.824234522409,$11,,Great Opportunity for a Commercial Building with Excellent Traffic exposure. with 11400 sqf Warehouse Space and 2400 Sqf of Retail Office Space. The Warehouse space consists of a section approxiately ...
"88D MANITOBA Drive CLARENVILLE, Newfoundland &amp; Labrador",https://www.kijiji.ca/v-commercial-office-space/st-johns/88d-manitoba-drive-clarenville-newfoundland-labrador/1720256328,"MANITOBA Drive, CLARENVILLE, NL, A5A1K7",48.163148734488,-53.981324961597,$2100,,"PRIME COMMERCIAL SPACE located just off Manitoba Drive close to all amenities! This well laid out 1,950 square foot space has endless potential and possibilities - from anything commercial/retail to ..."
"Rooms for rent ! Quiet, clean, parking ,bus route",https://www.kijiji.ca/v-room-rental-roommate/st-johns/rooms-for-rent-quiet-clean-parking-bus-route/1723844787,"St. John&apos;s, NL A1E 2P5",47.526055144857,-52.765411787091,$700,Pets Allowed: No,"Clean quiet on bus route, parking internet cable laundry and hydro incl !! No smoking and no pets"
"28 Allston Street Mount Pearl, Newfoundland &amp; Labrador",https://www.kijiji.ca/v-commercial-office-space/st-johns/28-allston-street-mount-pearl-newfoundland-labrador/1723766641,"Allston Street, Mount Pearl, NL, A1N0A4",47.531821336697,-52.824514726697,$16,,"Located next to Topsail Rd and Kenmount Rd, close to all Major Access Roads! There is approximately 1900sq ft of office/warehouse space consisting of 2 offices, reception, washroom and kitchenette. ..."
"15 Hickey&apos;s Lane - 10 Month Rental (until June 30th, 26)",https://www.kijiji.ca/v-short-term-rental/st-johns/15-hickeys-lane-10-month-rental-until-june-30th-26/1722008623,"15 Hickeys Lane, Flatrock, NL, A1K 1C5",47.706869015334,-52.708815835746,$1100,Bedrooms: 2 *** Bathrooms: 1 *** Pets Allowed: No,"15 Hickey&apos;s Lane is a fully furnished, two bedroom home situated on the most amazing lot, with spectacular ocean views in the wonderful town of Flatrock. This home is steps from the East Coast Trail ..."
Roomate for rent in 3 bedroom house with owner...i,https://www.kijiji.ca/v-room-rental-roommate/st-johns/roomate-for-rent-in-3-bedroom-house-with-owner-i/1723709029,"St. John&apos;s, NL A1E 5S4",47.532269948876,-52.774877889443,$650,Pets Allowed: No,Sole owner/occupant of a beautiful 3 bedroom home in Cowan Heights. Looking to rent only one room parking avalavable..all utilties included. Quiet individivual please..$650.00 . please email or call ...
"38 Duffy Place Unit#101 St. John&apos;s, Newfoundland &amp; Labrador",https://www.kijiji.ca/v-commercial-office-space/st-johns/38-duffy-place-unit-101-st-johns-newfoundland-labrador/1723656168,"Duffy Place Unit#101, St. John&apos;s, NL, A1B4M5",47.559707438368,-52.77609871364,$18,,"One of the most amazing buildings in the city with stunning views from the large windows. This suite is can be developed and the vendor is willing to redesign - entrance, offices, bathroom. Located ..."
"10 Forbes Street Unit#201 St. John&apos;s, Newfoundland &amp; Labrador",https://www.kijiji.ca/v-commercial-office-space/st-johns/10-forbes-street-unit-201-st-johns-newfoundland-labrador/1723655118,"Forbes Street Unit#201, St. John&apos;s, NL, A1E3L5",47.536787333683,-52.745056419049,$795,,"FOR LEASE! Ideally situated in a convenient, high traffic area, near the Village Mall! Located on the second level, this bright and spacious office suite consists of a waiting/reception area, 2 ..."
"25 Hebron Way Unit#B St. John&apos;s, Newfoundland &amp; Labrador",https://www.kijiji.ca/v-commercial-office-space/st-johns/25-hebron-way-unit-b-st-johns-newfoundland-labrador/1716126786,"Hebron Way Unit#B, St. John&apos;s, NL, A1A5G9",47.624105055641,-52.720318489112,$17,,"PRIME LOCATION!! This is an unbelievable opportunity to have your very own retail, restaurant, storefront or office space in one of the best locations in the city! 25 Hebron Way is centrally located ..."
bedsitting rooms for rent,https://www.kijiji.ca/v-short-term-rental/st-johns/bedsitting-rooms-for-rent/1723634941,"31 Goodview St, St. John&apos;s, NL A1C 4G2",47.562671991793,-52.713788986538,$800,Bathrooms: 1,Bedsitting rooms for rent Fully furnished. Utilities included. Contact 709 730 9933
"40 Henry Street Unit#603 St. John&apos;s, Newfoundland &amp; Labrador",https://www.kijiji.ca/v-commercial-office-space/st-johns/40-henry-street-unit-603-st-johns-newfoundland-labrador/1723603264,"Henry Street Unit#603, St. John&apos;s, NL, A1C1R7",47.563328923454,-52.709703227836,$3100,,"Welcome to Star of the Sea Residences, where modern design meets historic harbourfront living. This 2-bedroom, 2-bath suite on the 6th floor offers bright open-concept living with oversized windows, ..."
"40 Henry Street Unit#407 St. John&apos;s, Newfoundland &amp; Labrador",https://www.kijiji.ca/v-commercial-office-space/st-johns/40-henry-street-unit-407-st-johns-newfoundland-labrador/1723603263,"Henry Street Unit#407, St. John&apos;s, NL, A1C1R7",47.563328923454,-52.709703227836,$1950,,"Sleek, simple, and perfectly located — this 1-bedroom, 1-bath condo in the sought-after Star of the Sea Residences delivers the best of downtown living without compromise. The open-concept layout ..."
"12 GLENEYRE Street Unit#306 ST. JOHN&apos;S, Newfoundland &amp; Labrador",https://www.kijiji.ca/v-commercial-office-space/st-johns/12-gleneyre-street-unit-306-st-johns-newfoundland-labrador/1723601126,"GLENEYRE Street Unit#306, ST. JOHN&apos;S, NL, A1A2M7",47.601660791599,-52.713348433708,$18,,"Located on the corner of Torbay Rd and Gleneyre St,this office space is a great option for a professional or medical clinic. Building is well maintained, offers 92 parking spaces. Operating costs ..."
One Bedroom Apartment l Short/Long Term,https://www.kijiji.ca/v-short-term-rental/st-johns/one-bedroom-apartment-l-short-long-term/1722008838,"Forest Rd, St. John&apos;s, NL, A1A1E8",47.579130098275,-52.686896550567,$1500,Bedrooms: 1 *** Bathrooms: 1 *** Pets Allowed: No,"Availabile from October 1! Above ground one bedroom apartment in a peaceful neighbourhood. Rent includes utilities and Internet. The house comes with Air Conditioning, Washer-Dryer, Stove-Oven, ..."
Downtown Home for Rent - Short Term,https://www.kijiji.ca/v-short-term-rental/st-johns/downtown-home-for-rent-short-term/1723577253,"St. John&apos;s, NL A1A 1A1",47.570642092065,-52.696134351518,$3500,Bedrooms: 3 *** Bathrooms: 2,"Stunning oceanfront executive FURNISHED home for LEASE on a quiet cul-de-sac in the heart of downtown. This beautiful property oﬀers spectacular views of the city and the harbour, and is walking ..."
House for Rent - Short Term,https://www.kijiji.ca/v-short-term-rental/st-johns/house-for-rent-short-term/1723576952,"St. John&apos;s, NL A1A 1A2",47.57005217372,-52.695371095415,$2500,Bedrooms: 2 *** Bathrooms: 1.5 *** Pets Allowed: No,"Oceanfront FURNISHED home for LEASE on a quiet cul-de-sac in the heart of downtown. This beautiful property oﬀers spectacular views of the city and the harbour, and is walking distance to all ..."
Room for Rent,https://www.kijiji.ca/v-room-rental-roommate/st-johns/room-for-rent/1723548179,"St. John&apos;s, NL A1B 1X4",47.583293778628,-52.715505767947,$750,Pets Allowed: No,"Room for rent 5 minutes from CNA 10 minutes from MUN In a mature East End neighborhood.Close to walking trail,frisbee field and Churchill square Room is located in private area of the house with a ..."
"40 Aberdeen Avenue Unit#006 St. John&apos;s, Newfoundland &amp; Labrador",https://www.kijiji.ca/v-commercial-office-space/st-johns/40-aberdeen-avenue-unit-006-st-johns-newfoundland-labrador/1719892799,"Aberdeen Avenue Unit#006, St. John&apos;s, NL, A1A5T3",47.617158721023,-52.714143624862,$18,,"Located in the lower level of the KMK Capital Building at 40 Aberdeen Avenue. This 2,226 sq. ft. office space offers a quiet, professional setting ideal for a wide range of businesses. The space ..."
Spacious 3-bedroom main floor bungalow,https://www.kijiji.ca/v-short-term-rental/st-johns/spacious-3-bedroom-main-floor-bungalow/1723506722,"Motion Lane, Torbay, NL",47.658952,-52.71572,$2300,Bedrooms: 3 *** Bathrooms: 1 *** Pets Allowed: No,"Available September 1, 2025 - May or June, 2026, a fully furnished, spacious bungalow with ocean deck. 15 minutes from the capital city of St. Johns, close to Memorial University, the Health Sciences ..."
Room for rent,https://www.kijiji.ca/v-room-rental-roommate/st-johns/room-for-rent/1719734761,"Conroy Pl, St. John&apos;s, NL A1B 2K3",47.591125996593,-52.731910168613,$650,,"One private room available in a clean, quiet 3-bedroom home. ✅ $650/month – Heat, Electricity &amp; Wi-Fi Included ✅ Washer/Dryer in unit ✅ Quiet cul-de-sac, safe neighborhood ✅ 3-minute walk to bus ..."
