title,url,address,latitude,longitude,price,info,description
Room for rent - All inclusive ,https://www.kijiji.ca/v-room-rental-roommate/st-johns/room-for-rent-all-inclusive/1733638684,"St. John&apos;s, NL, A1B",47.568528373,-52.7765471,$750,,"Rooms available for rent in a recently renovated house in a prime location – Empire Avenue (behind Sobeys Ropewalk lane), St. John’s. Rooms available immediately. House is close to bus stops (1,19), ..."
2 private room in a shared house  ,https://www.kijiji.ca/v-room-rental-roommate/st-johns/2-private-room-in-a-shared-house/1733631612,"113 Gloucester St, St. John&apos;s, NL A1B 5B1",47.594242011008,-52.735580006957,$650,,Two Rooms Available in Spacious 4 bedroom house Room 1 - Master Bedroom (attached washroom) - $800 Room 2 - standard size- $650 Sublet Room | March–Mid July 2026 | Utilities Included | Extension ...
Room for rent,https://www.kijiji.ca/v-room-rental-roommate/st-johns/room-for-rent/1733617495,"Eastaff St, St. John&apos;s, NL A1E 2J4",47.538854758506,-52.748310590282,$750,Pets Allowed: No,"✨ Bright, Clean Room for Rent – Ideal for Student, female preferred home (Near Anspach St.) ✨ Looking for a quiet, responsible person to share a cozy and welcoming home near Anspach Street. This ..."
room for rent,https://www.kijiji.ca/v-room-rental-roommate/st-johns/room-for-rent/1733608110,"14 Cherry Hill Rd, St. John&apos;s, A1A 1X1",47.58377401977,-52.712661033828,$540,,Available room for rent suitable for young men. Message for pictures
A Room for Rent,https://www.kijiji.ca/v-room-rental-roommate/st-johns/a-room-for-rent/1730740477,"50 Gil Eannes Drive, St. John&apos;s, NL A1B 5C4",47.546531002757,-52.793456964564,$500,,"Location: Kenmount Terrace. Available: immediately Rent: $500/month. Free Wifi ⚡ Utilities: Electricity Share among over Tenants Details: • Private room • Furnished • Shared bathroom • Currently, 4 ..."
Large room for rent ,https://www.kijiji.ca/v-room-rental-roommate/st-johns/large-room-for-rent/1733582120,"Janeway Place, St. John&apos;s, A1A 1R6",47.590166555468,-52.688856062543,$1000,,"Available May 1 • Large primary bedroom + queen bed included • Two closets • Shared bathroom • 1,800 sq ft home with big backyard • Parking available • Utilities included Professional female ..."
"40 Aberdeen Avenue Unit#006 St. John&apos;s, Newfoundland &amp; Labrador",https://www.kijiji.ca/v-commercial-office-space/st-johns/40-aberdeen-avenue-unit-006-st-johns-newfoundland-labrador/1719892799,"Aberdeen Avenue Unit#006, St. John&apos;s, NL, A1A5T3",47.617158721023,-52.714143624862,$18,,"Located in the lower level of the KMK Capital Building at 40 Aberdeen Avenue. This 2,226 sq. ft. office space offers a quiet, professional setting ideal for a wide range of businesses. The space ..."
"95 Lemarchant Road Unit#101 St. John&apos;s, Newfoundland &amp; Labrador",https://www.kijiji.ca/v-commercial-office-space/st-johns/95-lemarchant-road-unit-101-st-johns-newfoundland-labrador/1730843127,"Lemarchant Road Unit#101, St. John&apos;s, NL, A1B2B7",47.566899446569,-52.750099139637,$5000,,"For lease! Approximately 3500 square feet of bright, spacious office space, conveniently located on Lemarchant Road in a secured building with off street parking and only minutes from downtown! ..."
2 private bedrooms available for rent: Furnished &amp; Free WiFi,https://www.kijiji.ca/v-room-rental-roommate/st-johns/2-private-bedrooms-available-for-rent:-furnished-free-wifi/1733536163,"46 Rotary Drive, St. John&apos;s, NL",47.548636411107,-52.752954518773,$540,Pets Allowed: No,"2 individual bedrooms for Rent • Availability: 1 bedroom is immediately, the 2nd available from March 1, 2026 • Fully furnished with double sized bed set, desk &amp; chair, night stand and dresser Rent: ..."
3 private bedrooms available: free WiFi &amp; furnished for rent,https://www.kijiji.ca/v-room-rental-roommate/st-johns/3-private-bedrooms-available:-free-wifi-furnished-for-rent/1733535598,"St. John&apos;s, NL A1E 0B9",47.548680038913,-52.753305133783,$490,Pets Allowed: No,3 private individual bedrooms are available (one car parking available)! Room 1: $490. Room 2: $550. Room 3: $560. All 3 bedrooms are fully furnished with free fast Fibre WiFi. Availability: room 1 ...
"100 Logy Bay Road St. John&apos;s, Newfoundland &amp; Labrador",https://www.kijiji.ca/v-commercial-office-space/st-johns/100-logy-bay-road-st-johns-newfoundland-labrador/1721695719,"Logy Bay Road, St. John&apos;s, NL, A1A1J6",47.58879321841,-52.701462606305,$19,,Are you searching for a scenic and private location to establish your commercial office or retail space? Look no further. This property offers a tranquil setting ideal for businesses looking to ...
"1082 Topsail Road Mount Pearl, Newfoundland &amp; Labrador",https://www.kijiji.ca/v-commercial-office-space/st-johns/1082-topsail-road-mount-pearl-newfoundland-labrador/1727608909,"Topsail Road, Mount Pearl, NL, A1N3K2",47.523598262887,-52.803009987766,$20,,"Brand new architecturally designed commercial building located centrally on the commercial hub of topsail road, between St. John&apos;s and Paradise in Mount Pearl. The stand alone building has 5300 sq ft ..."
"113 Main Road Heart&apos;s Content, Newfoundland &amp; Labrador",https://www.kijiji.ca/v-commercial-office-space/st-johns/113-main-road-hearts-content-newfoundland-labrador/1727607601,"Main Road, Heart&apos;s Content, NL, A0A1Z0",47.43978557989,-53.23922685964,$4200,,Building and Property FOR LEASE. Always dreamed of owning your own business? Take advantage of this incredible opportunity in the historic town of Hearts Content. Located on a high traffic corner of ...
looking for a 3-4 bedroom house to rent in Newfoundland St. John,https://www.kijiji.ca/v-short-term-rental/st-johns/looking-for-a-3-4-bedroom-house-to-rent-in-newfoundland-st-john/1733446871,"Newfoundland Dr, St. John&apos;s, NL A1A",47.601530325412,-52.704183803691,$2000,Bedrooms: 3 *** Bathrooms: 2.5,Hello! I’m looking for a house to rent with my family we are moving to new found land starting march 1 st we are 6 family members 3 adults 3 kids! Both of my parents and I have jobs and we can ...
"Room for rent, furnished, near Avalon Mall",https://www.kijiji.ca/v-room-rental-roommate/st-johns/room-for-rent-furnished-near-avalon-mall/1733433033,"St. John&apos;s, NL A1B 5E3",47.566699831545,-52.771455893652,$500,Pets Allowed: No,"Bedroom for rent in a 6 bedroom apartment with 2.5 bathrooms. Available March 16, 2026. Fully furnished with a twin bed, desk, chair, nightstand, and dresser. Location: 30 Faulkner St, St. John’s NL ..."
"42 O&apos;Leary Avenue St. John&apos;s, Newfoundland &amp; Labrador",https://www.kijiji.ca/v-commercial-office-space/st-johns/42-oleary-avenue-st-johns-newfoundland-labrador/1733415745,"O&apos;Leary Avenue, St. John&apos;s, NL, A1B2C7",47.559531636805,-52.763076210879,$3000,,"Position your business in one of St. John’s most convenient commercial corridors, just minutes from the Avalon Mall, Kelsey Drive, and Kenmount Road. This approximately 1,460 square foot unit offers ..."
"113 Main Road Heart&apos;s Content, Newfoundland &amp; Labrador",https://www.kijiji.ca/v-commercial-office-space/st-johns/113-main-road-hearts-content-newfoundland-labrador/1715802881,"Main Road, Heart&apos;s Content, NL, A0A1Z0",47.43978557989,-53.23922685964,$4200,,Building and Property FOR LEASE. Always dreamed of owning your own business? Take advantage of this incredible opportunity in the historic town of Hearts Content. Located on a high traffic corner of ...
Room for rent,https://www.kijiji.ca/v-room-rental-roommate/st-johns/room-for-rent/1733403094,"St. John&apos;s, NL A1E",47.535885121,-52.753040947,$700,Pets Allowed: No,"One-Bedroom Available for rent March1st or earlier. furnished one-bedroom in shared apartment. You&apos;ll share the kitchen, washroom, and laundry room with two other respectful female roommates. ..."
Furnished Short term- April/May only,https://www.kijiji.ca/v-short-term-rental/st-johns/furnished-short-term-april-may-only/1733389413,"St. John&apos;s, NL A1C 2C3",47.571123548584,-52.702909695312,$1495,Bedrooms: 7 *** Bathrooms: 1 *** Pets Allowed: Yes,"Renovated, furnished, and equipped. Great walkability to downtown attractions and Signal Hill. Parking permit included for street parking. Clean, quiet, mature pet considered. Only available for ..."
Fully Furnished House in Torbay with Ocean View,https://www.kijiji.ca/v-short-term-rental/st-johns/fully-furnished-house-in-torbay-with-ocean-view/1728083232,"Torbay, NL A1K 1B3",47.659086299901,-52.73372894746,$3200,Bedrooms: 2 *** Bathrooms: 1.5 *** Pets Allowed: No,"Available January 1, 2026– May 31, 2026, a fully furnished and equipped two-story house located in the historic Town of Torbay. It is approximately 15 minutes from the capital city, St. John’s, and, ..."
Quiet Room in East End Home - $750 All Inclusive.,https://www.kijiji.ca/v-room-rental-roommate/st-johns/quiet-room-in-east-end-home-750-all-inclusive/1733244492,"Stavanger Drive, St. John&apos;s, NL",47.619106,-52.706075,$750,Pets Allowed: No,"Rooms for Rent – East End St. John&apos;s Clean, quiet room available in well-maintained shared home. Perfect for responsible student(s), Friends or working professional seeking a peaceful living ..."
Perfect for students! Two rooms for rent in large house by MUN,https://www.kijiji.ca/v-room-rental-roommate/st-johns/perfect-for-students-two-rooms-for-rent-in-large-house-by-mun/1733229922,"St. John&apos;s, NL A1B 2Y3",47.573109514813,-52.725106651301,$550,Pets Allowed: No,Two rooms for rent in a spacious house right across the street from MUN. Laundry and dishwasher in house. $550 POU. Utilities average about $100/month We have one friendly cat.
"67 Majors Path Unit#201 St. John&apos;s, Newfoundland &amp; Labrador",https://www.kijiji.ca/v-commercial-office-space/st-johns/67-majors-path-unit-201-st-johns-newfoundland-labrador/1731856018,"Majors Path Unit#201, St. John&apos;s, NL, A1A1Z9",47.587392696919,-52.703260310322,$14,,Hard to find a better location! Close to Stavanger Drive and the Outer Ring Road. This 2nd floor self contained multi-use space in the Reardon Building at 67 Majors Path includes 2915 sq/ft of ...
"510 Topsail Road Unit#106 St. John&apos;s, Newfoundland &amp; Labrador",https://www.kijiji.ca/v-commercial-office-space/st-johns/510-topsail-road-unit-106-st-johns-newfoundland-labrador/1731854310,"Topsail Road Unit#106, St. John&apos;s, NL, A1E2C2",47.532543827562,-52.75395900605,$1150,,"Whether you tired of working from home and having the kids interrupt your work day or you just need an office or two to run your business, this space has it all. There is even a boardroom that can ..."
"510 Topsail Road Unit#105 St. John&apos;s, Newfoundland &amp; Labrador",https://www.kijiji.ca/v-commercial-office-space/st-johns/510-topsail-road-unit-105-st-johns-newfoundland-labrador/1731854308,"Topsail Road Unit#105, St. John&apos;s, NL, A1E2C2",47.532543827562,-52.75395900605,$950,,"Whether you tired of working from home and having the kids interrupt your work day or you just need an office or two to run your business, this space has it all. There is even a boardroom that can ..."
"510 Topsail Road Unit#116 St. John&apos;s, Newfoundland &amp; Labrador",https://www.kijiji.ca/v-commercial-office-space/st-johns/510-topsail-road-unit-116-st-johns-newfoundland-labrador/1731854309,"Topsail Road Unit#116, St. John&apos;s, NL, A1E2C2",47.532543827562,-52.75395900605,$1050,,"Whether you tired of working from home and having the kids interrupt your work day or you just need an office or two to run your business, this space has it all. There is even a boardroom that can ..."
"39 Pippy Place St. John&apos;s, Newfoundland &amp; Labrador",https://www.kijiji.ca/v-commercial-office-space/st-johns/39-pippy-place-st-johns-newfoundland-labrador/1733191688,"Pippy Place, St. John&apos;s, NL, A1B3X2",47.559287804544,-52.770110149734,$25,,"Available for lease: 3036 sq ft located on the 3rd floor at 39 Pippy Place, is now available for lease. HEAT AND LIGHT INCLUDED. Large windows fill the space, creating a bright and inviting ..."
Room for Rent- $570.00/Month,https://www.kijiji.ca/v-room-rental-roommate/st-johns/room-for-rent-570-00-month/1733179669,"St. John&apos;s, NL A1B 4R9",47.56197017504,-52.760637455043,$570,Pets Allowed: No,Spacious bedroom available for Rent in a 3-Bedroom main floor apartment- Male preferred since there are already two male residents- Student or Working Class- Single Occupancy only. Availability: ...
"124 Glencoe Drive Mount Pearl, Newfoundland &amp; Labrador",https://www.kijiji.ca/v-commercial-office-space/st-johns/124-glencoe-drive-mount-pearl-newfoundland-labrador/1733149304,"Glencoe Drive, Mount Pearl, NL, A1N4S9",47.512806375629,-52.84891662081,$16,,"Modern Warehouse for Lease – Donovans Industrial Park This modern industrial warehouse offers 32-foot ceilings, making it ideal for businesses requiring high-volume storage. Located in Donovans ..."
"1A Anderson Avenue St. John&apos;s, Newfoundland &amp; Labrador",https://www.kijiji.ca/v-commercial-office-space/st-johns/1a-anderson-avenue-st-johns-newfoundland-labrador/1731760052,"Anderson Avenue, St. John&apos;s, NL, A1B3E1",47.563925749058,-52.733302141102,$2800,,"Space for Lease – Ideal for Small Professional Firms. Position your business in a high-traffic, highly visible location with this bright, well-maintained office space. Formerly home to a successful ..."
"30-44 Ropewalk Lane St. John&apos;s, Newfoundland &amp; Labrador",https://www.kijiji.ca/v-commercial-office-space/st-johns/30-44-ropewalk-lane-st-johns-newfoundland-labrador/1733103261,"Ropewalk Lane, St. John&apos;s, NL, A1E5T2",47.555796,-52.736901,$19,,"Unit 1 at 30–44 Ropewalk Lane offers approximately 3,600 square feet of versatile commercial space in a well-located and highly accessible area of St. John’s. This ground-level unit provides ..."
Room Available in Spacious Main-Floor Home – 113 Gloucester Stre,https://www.kijiji.ca/v-room-rental-roommate/st-johns/room-available-in-spacious-main-floor-home-113-gloucester-stre/1733089747,"Gloucester St, St. John&apos;s, NL A1B 5B1",47.588371825327,-52.734706856768,$650,,"Available from- February 1st, 2026 ( move in asap) We’re looking for one clean and respectful roommate to join a 4-bedroom home, currently shared with other working professionals. It’s a quiet, ..."
On-Campus Westerland Sublet (May–Aug 2026),https://www.kijiji.ca/v-short-term-rental/st-johns/on-campus-westerland-sublet-may-aug-2026/1731277782,"10 Lambe&apos;s Ln, St. John&apos;s, NL A1B 4E9",47.568823854122,-52.735503865032,$657,Bedrooms: 1 *** Bathrooms: 2 *** Pets Allowed: Yes,"Sublet Available – Westerland (On-Campus) I’m subletting one private bedroom in a 5-bedroom all-girls apartment at Westerland. The remaining term of my lease runs from May 1, 2026 to August 31, 2026, ..."
2 Bedroom Furnished Apartment for RENT,https://www.kijiji.ca/v-room-rental-roommate/st-johns/2-bedroom-furnished-apartment-for-rent/1733074437,"St. John&apos;s, NL A1C 2G9",47.562072685716,-52.71618587557,$2000,,2 Bedroom apartment for rent
"185 Commonwealth Avenue Mount Pearl, Newfoundland &amp; Labrador",https://www.kijiji.ca/v-commercial-office-space/st-johns/185-commonwealth-avenue-mount-pearl-newfoundland-labrador/1733057189,"Commonwealth Avenue, Mount Pearl, NL, A1N4L3",47.507075424119,-52.793976156207,$1000,,"This space is well suited for warehouse and storage. The lease includes snow clearing, exterior maintenance, and common area costs. Located on the back of the main building and is inside the gated ..."
"Room with a View in a House Downtown, Text to View, No Pets",https://www.kijiji.ca/v-room-rental-roommate/st-johns/room-with-a-view-in-a-house-downtown-text-to-view-no-pets/1733050383,"24 King&apos;s Rd, St. John&apos;s, NL A1C 3P1",47.568427006513,-52.704261025742,$545,Pets Allowed: No,"Please contact Jon by *text only* at 709-769-9400 to schedule a viewing No dogs, no cats, no exceptions References and proof of income required Single occupancy room, furnished with a single bed and ..."
SUBLET- Partially Furnished Room | 550 POU,https://www.kijiji.ca/v-room-rental-roommate/st-johns/sublet-partially-furnished-room-550-pou/1733045336,"St. John&apos;s, NL, A1B1H5",47.558237587827,-52.747856309986,$550,Pets Allowed: Yes,"This a sublet starting Feb 15th 2026- April 30th,2026. This partially furnished room is perfect for anyone looking for a short term rental for 2 months. Room comes furnished with a Queen mattress, a ..."
Short Term Rental ONLY - Furnished Apartment for Rent,https://www.kijiji.ca/v-short-term-rental/st-johns/short-term-rental-only-furnished-apartment-for-rent/1728988262,"24 Melrose Pl, St. John&apos;s, NL A1E 5V3",47.538681979076,-52.76733803226,$1250,Bedrooms: 2 *** Bathrooms: 1,Apartment for Rent. Furnished. West End. Separate parking. Available for 7 months only until July 2026. Seperate driveway. Video available upon request.
"75 Tiffany Court St. John&apos;s, Newfoundland &amp; Labrador",https://www.kijiji.ca/v-commercial-office-space/st-johns/75-tiffany-court-st-johns-newfoundland-labrador/1725097792,"Tiffany Court, St. John&apos;s, NL, A1A0L1",47.588310976321,-52.713784963225,$25,,"Now available in the highly sought-after East End, this professional space offers approximately 3,530 sq. ft. of well-laid-out floor area, ideal for a wide range of business uses but ideal for ..."
"35 Campbell Avenue St. John&apos;s, Newfoundland &amp; Labrador",https://www.kijiji.ca/v-commercial-office-space/st-johns/35-campbell-avenue-st-johns-newfoundland-labrador/1731572000,"Campbell Avenue, St. John&apos;s, NL, A1E2Z3",47.554541819579,-52.726005130926,$14,,Retail and Office building for lease . 4667sqft space. Previously occupied by Doctors . There is one additional floor of office space (equivalent square footage of 4667sqft each) which is currently ...
"1147 - Unit 2 Topsail Road Mount Pearl, Newfoundland &amp; Labrador",https://www.kijiji.ca/v-commercial-office-space/st-johns/1147-unit-2-topsail-road-mount-pearl-newfoundland-labrador/1731571147,"- Unit 2 Topsail Road, Mount Pearl, NL, A1N5G2",47.52703134321,-52.823595270898,$21,,"Ready for immediate occupancy, this bright office space has potential for many applications. High traffic area with store front on Topsail Road located in commercial neighborhood. Suite has been ..."
"185 Commonwealth Avenue Mount Pearl, Newfoundland &amp; Labrador",https://www.kijiji.ca/v-commercial-office-space/st-johns/185-commonwealth-avenue-mount-pearl-newfoundland-labrador/1719007278,"Commonwealth Avenue, Mount Pearl, NL, A1N4L3",47.507075424119,-52.793976156207,$4500,,"Located in the Heart of Mount Pearl, 1 Acres of fully fenced yard space for lease for $4500/month. There are options here for you to use as little or as much space as you need with the price being ..."
"40 Airport Heights Drive St. John&apos;s, Newfoundland &amp; Labrador",https://www.kijiji.ca/v-commercial-office-space/st-johns/40-airport-heights-drive-st-johns-newfoundland-labrador/1731520593,"Airport Heights Drive, St. John&apos;s, NL, A1A4Z7",47.602706313899,-52.744104318398,$22,,"Prime main-floor commercial space in a sought-after area. Turnkey, fully updated medical/office suite (approx. 2,180 sq ft) featuring multiple exam/treatment rooms, private offices, spacious ..."
Large Room in Large Home for Rent,https://www.kijiji.ca/v-room-rental-roommate/st-johns/large-room-in-large-home-for-rent/1732879988,"St. John&apos;s, NL A1C 3A3",47.570464437627,-52.715097233986,$700,Pets Allowed: No,"Large Room for Rent [Lease takeover]: The home is located in the well sought after neighborhood of Georgetown (10 minute walk to MUN, Grocery, Bannerman Park and other ammenities), with free street ..."
Room for Rent Feb 15th or March 1st,https://www.kijiji.ca/v-room-rental-roommate/st-johns/room-for-rent-feb-15th-or-march-1st/1729686666,"59 Lester St, St. John&apos;s, NL A1E 2P5",47.52603498638,-52.765492001905,$600,Pets Allowed: No,Private Room for rent available January located at 59 Lester Street. Rent includes Internet/Cable/Heat and light. Bus route directly on Lester Street and other routes located near. Close to a ...
"607 Torbay Road St. John&apos;s, Newfoundland &amp; Labrador",https://www.kijiji.ca/v-commercial-office-space/st-johns/607-torbay-road-st-johns-newfoundland-labrador/1726803320,"Torbay Road, St. John&apos;s, NL, A1A5G9",47.62196750391,-52.723716352797,$18,,** LOCATION LOCATION LOCATION ** Welcome to 607 Torbay Road. This fantastic lower floor space is in a high traffic area with tons of visibility in the East End of St. John’s. It is surrounded by ...
"22 Vardy&apos;s Avenue Clarenville, Newfoundland &amp; Labrador",https://www.kijiji.ca/v-commercial-office-space/st-johns/22-vardys-avenue-clarenville-newfoundland-labrador/1731471463,"Vardy&apos;s Avenue, Clarenville, NL, A5A1Z9",48.158212572291,-53.966181186839,$1100,,"Prime office/retail space available in high traffic location. The current configuration of the 800 sq/ft space includes a boardroom, 2 offices and a bathroom. This would make an ideal location for ..."
Furnished Room for Rent,https://www.kijiji.ca/v-room-rental-roommate/st-johns/furnished-room-for-rent/1732858434,"51 Ladysmith Drive, St. John&apos;s, NL A1B 0G3",47.549754515081,-52.788941298048,$700,,"Furnished Room for Rent – Available March 1st A quiet and clean furnished room is available for rent. Conveniently located near public transportation and a shopping center. • Peaceful, ..."
"146 Glencoe Drive Mount Pearl, Newfoundland &amp; Labrador",https://www.kijiji.ca/v-commercial-office-space/st-johns/146-glencoe-drive-mount-pearl-newfoundland-labrador/1732827112,"Glencoe Drive, Mount Pearl, NL, A1N4S7",47.514064778042,-52.849344449379,$15,,"Located in popular Donovan&apos;s Industrial Park, this spacious building offers a main floor footprint of 5,000 square feet ($15 triple net), complemented by an additional 4,650 square feet of mezzanine ..."
Rooms for rent!,https://www.kijiji.ca/v-room-rental-roommate/st-johns/rooms-for-rent/1732727108,"11 Alderdice Pl, St. John&apos;s, NL",47.580511992602,-52.713873979037,$650,Pets Allowed: No,"2 bedrooms for Rent – Spacious Semi-Furnished Home 15min walk from Memorial University /CNA $650 + POU A private room is available for rent in a large, clean, and well-maintained semi-furnished ..."
Private room for rent,https://www.kijiji.ca/v-room-rental-roommate/st-johns/private-room-for-rent/1729636125,"10 Lambe&apos;s Ln, St. John&apos;s, NL A1B 4E9",47.568823854122,-52.735503865032,$699,,"Available now for lease transfer Private fully furnished room in a clean, brand-new 4 bed / 2 bath apartment. • Rent: $699/month (utilities included) • Location: On MUN campus – perfect for students ..."
ROOM 4 RENT,https://www.kijiji.ca/v-room-rental-roommate/st-johns/room-4-rent/1732650530,"Port of St. John’s, St. John&apos;s, A1C 6N6",47.558821848388,-52.708864115509,$900,Pets Allowed: No,"Renting out the master bedroom. (unfurnished) - downtown, two story detached house - 2 bed+den - full kitchen +microwave, air fryer, mixer, etc - large laundry room with lots of storage space - large ..."
Room for rent $800 in St. John&apos;s NL,https://www.kijiji.ca/v-room-rental-roommate/st-johns/room-for-rent-800-in-st-johns-nl/1732541322,"St. John&apos;s, NL A1B 0J1",47.55303460525,-52.792159865048,$800,Pets Allowed: No,"Room for rent in a two-bedroom house in a quiet, friendly neighbourhood. Shared bathroom and kitchen with a male tenant."
Rooms Available – February 1st,https://www.kijiji.ca/v-room-rental-roommate/st-johns/rooms-available-february-1st/1732308150,"29 Bells Turn, St. John&apos;s, NL",47.594192012956,-52.728926033121,$525,Pets Allowed: No,"Two furnished rooms on the main floor are available starting February 1st. Bigger room: $625/month Smaller room: $525/month ✅ All utilities included (electricity, heat, hot water, and high-speed ..."
bedsitting room for rent,https://www.kijiji.ca/v-room-rental-roommate/st-johns/bedsitting-room-for-rent/1726339355,"1 Bay Bulls Rd, St. John&apos;s, NL A1G 1A2",47.528836008873,-52.741248017522,$800,,"Room for rent , Fully furnished Contact for more info 7097309933"
Room for rent - Available feb 01,https://www.kijiji.ca/v-room-rental-roommate/st-johns/room-for-rent-available-feb-01/1732448513,"Ladysmith Drive, St. John&apos;s, NL",47.55479377402,-52.792179593925,$660,Pets Allowed: No,"Room rent is inclusive of all utilities. If moving on February 01, I can offer you a discount on first month&apos;s rent The room is furnished with chair, table, bed, mattress and desk. There is high ..."
Furnished rooms at MUN entrance,https://www.kijiji.ca/v-room-rental-roommate/st-johns/furnished-rooms-at-mun-entrance/1732415181,"St. John&apos;s, NL A1B 1T4",47.572430874022,-52.726941366087,$630,Pets Allowed: No,"Two large furnished bedrooms are now available for occupancy in a house at 217 Elizabeth Avenue, which is located just at the entrance of the Memorial University (MUN) St. John’s campus with ..."
"Spacious, Large Room For Rent in Paradise",https://www.kijiji.ca/v-room-rental-roommate/st-johns/spacious-large-room-for-rent-in-paradise/1729208314,"Paradise, NL A1L 3M8",47.553757041485,-52.896714635611,$900,Pets Allowed: No,"Not on a bus route/located off St. Thomas Line Driveway parking. Includes: heat/light, internet, washer/dryer. Large, private room is a separate area located downstairs in the home. Includes tv, ..."
Room for rent,https://www.kijiji.ca/v-room-rental-roommate/st-johns/room-for-rent/1732286107,"St. John&apos;s, NL A1B 3K7",47.557796112987,-52.750340957544,$550,Pets Allowed: No,"Furnished room for rent in an all female apartment. The apartment is located across from the avalon mall and directly infront of bus stop. 16 min direct to MUN. Fully furnished and all utility, ..."
