title,url,address,latitude,longitude,price,info,description
"3 Barnes Place St. John&apos;s, Newfoundland &amp; Labrador",https://www.kijiji.ca/v-apartments-condos/st-johns/3-barnes-place-st-johns-newfoundland-labrador/1731760036,"Barnes Place, St. John&apos;s, NL, A1C5G9",47.568328519151,-52.709792495104,$2500,Bedrooms: 2 *** Bathrooms: 2 *** Size (sq ft): 0 *** Pets Allowed: No *** Lease Length: Not Available,"FOR 6 MONTH LEASE! Sweet, charming, heritage style home located at the end of a quiet lane way in the heart of trendy Georgetown. This fully detached home, with large fenced rear yard, is tastefully ..."
3 Bedroom Apartment,https://www.kijiji.ca/v-apartments-condos/st-johns/3-bedroom-apartment/1733116363,"St. John&apos;s, NL, A1C5G5",47.556827793623,-52.731173808096,$2000,Bedrooms: 3 *** Bathrooms: 1 *** Size (sq ft): 1100 *** Pets Allowed: Yes *** Lease Length: month-to-month,"✨ Beautiful Newly Renovated 3-Bedroom Apartment✨ Prime Location between The Village &amp; Avalon Mall • Bright, spacious 3 bedrooms • Modern finishes with lots of natural light • Brand-new appliances ..."
Kenny&apos;s Park - 1 Bedroom 1 Bath Apartment for Rent,https://www.kijiji.ca/v-apartments-condos/st-johns/kennys-park-1-bedroom-1-bath-apartment-for-rent/1731713028,"35 Tiffany Lane, St. John&apos;s, NL, A1A 3B7",47.588850980433,-52.714912999754,$1100,Bedrooms: 1 *** Bathrooms: 1 *** Size (sq ft): 510 *** Pets Allowed: No *** Lease Length: one-year,"Current Promotions: Resident Insurance included Kenny’s Park is a 3-storey building with 122 suites, offering bachelor, 1-bedroom and 2-bedroom, 1 bathroom homes. All homes come with a fully equipped ..."
"Spacious &amp; Inviting, 2 BR Condo Centrally Located in, St. John’s",https://www.kijiji.ca/v-apartments-condos/st-johns/spacious-inviting-2-br-condo-centrally-located-in-st-john-s/1733073260,"St. John&apos;s, NL A1E 5Z7",47.543257324744,-52.750597276143,$1775,Bedrooms: 2 *** Bathrooms: 2.5 *** Size (sq ft): 800 *** Pets Allowed: No *** Lease Length: one-year,"Welcome to 6 Sarasota Court! This cozy and spacious 55+ seniors 2 bedroom condo is located in a quiet, mature neighborhood in St. John’s. As you enter this ground-level condo, you are greeted by a ..."
One bedroom furnished modern ground level apt. Downtown,https://www.kijiji.ca/v-apartments-condos/st-johns/one-bedroom-furnished-modern-ground-level-apt-downtown/1733068773,"St. John&apos;s, NL A1C 3P1, Canada",47.568207149193,-52.703720728263,$1775,Bedrooms: 1 *** Bathrooms: 1 *** Size (sq ft): 800 *** Pets Allowed: No *** Lease Length: one-year,One bedroom furnished Modern ground level apt.Downtown. Washer/dryer/fridge and stove inc. Has patio off main entrance. On street parking with city permit. Steps to Duckworth and Water st. ...
3 bedroom apartment,https://www.kijiji.ca/v-apartments-condos/st-johns/3-bedroom-apartment/1733049312,"Conception Bay South, NL A1W 5C4",47.508900699908,-52.961726520658,$1500,Bedrooms: 3 *** Bathrooms: 1 *** Size (sq ft): 1200 *** Pets Allowed: No *** Lease Length: one-year,"3-Bedroom Apartment Manuels/Long Pond (CBS) Quiet Cul-de-Sac Call 709-687-4397 Bright, spacious, and well-maintained 3-bedroom ground-level basement apartment offering approximately 1,200 sq. ft. of ..."
"22 Bond Street St. John&apos;s, Newfoundland &amp; Labrador",https://www.kijiji.ca/v-apartments-condos/st-johns/22-bond-street-st-johns-newfoundland-labrador/1733011263,"Bond Street, St. John&apos;s, NL, A1C1S5",47.568438985617,-52.706482498658,$3500,Bedrooms: 3 *** Bathrooms: 2 *** Size (sq ft): 0 *** Pets Allowed: No *** Lease Length: Not Available,"Move right in and enjoy effortless executive living on Bond Street. This fully renovated and fully furnished 3-bedroom, 2-bath residence is completely turnkey, with everything provided—from cookware, ..."
"368 Blackmarsh Road St. John&apos;s, Newfoundland &amp; Labrador",https://www.kijiji.ca/v-apartments-condos/st-johns/368-blackmarsh-road-st-johns-newfoundland-labrador/1731573278,"Blackmarsh Road, St. John&apos;s, NL, A1E1T5",47.538570089959,-52.769891137056,$2100,Bedrooms: 4 *** Bathrooms: 1 *** Size (sq ft): 0 *** Pets Allowed: No *** Lease Length: Not Available,"This spacious main floor is available for lease for $2,200 POU and is situated on an oversized lot backing onto a peaceful creek. The unit is currently vacant and ready for immediate occupancy, ..."
house for rent ,https://www.kijiji.ca/v-apartments-condos/st-johns/house-for-rent/1732938071,"77 Smallwood Dr, Mount Pearl, NL A1N 1B1",47.516352002284,-52.795918980984,$2700,Bedrooms: 4 *** Bathrooms: 2.5 *** Size (sq ft): 1800 *** Pets Allowed: No *** Lease Length: one-year,"HOUSE FOR RENT House have 4 bedrooms fully furnished house in the heat of Mountpearl . Gorgeous master bedroom its own balcony, 3 single bedroom they are furnished) 1 lage living rooms with full ..."
"22 Pennywell Road! Well Maintained, 4 BR Townhouse Located Near",https://www.kijiji.ca/v-apartments-condos/st-johns/22-pennywell-road-well-maintained-4-br-townhouse-located-near/1732936371,"St. John&apos;s, NL A1C 2K9",47.562909995933,-52.719549617134,$2100,Bedrooms: 4 *** Bathrooms: 2 *** Size (sq ft): 1000 *** Pets Allowed: No *** Lease Length: one-year,"Welcome to 22 Pennywell Rd! This beautifully updated 4-bedroom townhouse is ready for you to call home. This property has much to offer, including a large kitchen equipped with stainless steel ..."
"Spacious &amp; Functional 3 BR +Rec Room Main Floor Home, in CBS wit",https://www.kijiji.ca/v-apartments-condos/st-johns/spacious-functional-3-br-rec-room-main-floor-home-in-cbs-wit/1732927912,"Centennial Street, Mount Pearl, NL",47.518890882466,-52.80537266759,$1850,Bedrooms: 3 *** Bathrooms: 1 *** Size (sq ft): 1100 *** Pets Allowed: No *** Lease Length: one-year,"Welcome to 11 Windfall Crescent, nestled in the picturesque CBS area! This lovely 3-bedroom home offers the perfect blend of comfort and convenience, with easy access to the highway via Fowler Road. ..."
"103 Red Cliff Road Logy Bay, Newfoundland &amp; Labrador",https://www.kijiji.ca/v-apartments-condos/st-johns/103-red-cliff-road-logy-bay-newfoundland-labrador/1731520404,"Red Cliff Road, Logy Bay, NL, A1K3G2",47.636458703076,-52.67034882967,$4200,Bedrooms: 5 *** Bathrooms: 4 *** Size (sq ft): 0 *** Pets Allowed: No *** Lease Length: Not Available,"FOR LEASE! Fully Furnished with new hot tub, Executive 5 bedroom home on a 1 acre lot in Beautiful Logy Bay. Bright open concept living room with lighted tray ceiling, family room with fireplace, ..."
Ultra modern 3 bedroom apartment at Kenmount terrace,https://www.kijiji.ca/v-apartments-condos/st-johns/ultra-modern-3-bedroom-apartment-at-kenmount-terrace/1730012323,"Tigress St, St. John&apos;s, A1B 0L6",47.555802650205,-52.801616970343,$2400,Bedrooms: 3 *** Bathrooms: 2.5 *** Size (sq ft): 2200 *** Pets Allowed: No *** Lease Length: one-year,Less than 2 year old apartment home in kenmount terrace which is at thr doorstep of kelsey drive shopping district. This ultra modern large two storey home with mini split stuff sits on an oversized ...
Downtown Home for Rent,https://www.kijiji.ca/v-apartments-condos/st-johns/downtown-home-for-rent/1732845265,"St. John&apos;s, NL A1C 4H1",47.564925131185,-52.716329038477,$2600,Bedrooms: 3 *** Bathrooms: 1 *** Size (sq ft): 1216 *** Pets Allowed: No *** Lease Length: one-year,"Available March 1st Completely renovated, fully furnished downtown home for lease with backyard, two parking places (on-street), on a quiet street in the downtown core. Two spare rooms / offices. 3rd ..."
1 bedrm apt Gower St. $1200 P.O.U.,https://www.kijiji.ca/v-apartments-condos/st-johns/1-bedrm-apt-gower-st-1200-p-o-u/1732838651,"St. John&apos;s, NL A1C 1N3",47.56943576856,-52.703541355535,$1200,Bedrooms: 1 *** Bathrooms: 1 *** Size (sq ft): 600 *** Pets Allowed: No *** Lease Length: month-to-month,"Bright, spacious 1 bdrm downtown located close to all amenities. Apartment is on the top floor of a 2 story house. Owner lives downstairs. Parking on street with permit, but no designated driveway. ..."
Luxury Living | 1 &amp; 2 Bedroom Layouts available |,https://www.kijiji.ca/v-apartments-condos/st-johns/luxury-living-1-2-bedroom-layouts-available/1730140958,"11 &amp; 15 St. John&apos;s Place, St. John&apos;s, NL, A1A 0L8",47.585652697638,-52.693540739218,$2300,Bedrooms: 2 *** Bathrooms: 1.5 *** Size (sq ft): 1090 *** Pets Allowed: No *** Lease Length: one-year,"Chelsea Place - 11 St. John&apos;s Place Chelsea Place, located in the residential area above Quidi Vidi Lake, is very close to both the Virginia River, and Quidi Vidi trails, and a short walk to ..."
Beautiful 3 bedroom 2 and 1/2 bathroom Apartment.,https://www.kijiji.ca/v-apartments-condos/st-johns/beautiful-3-bedroom-2-and-1-2-bathroom-apartment/1732787194,"Faulkner St, St. John&apos;s, NL A1B 4L5",47.566726246345,-52.769072849373,$2350,Bedrooms: 3 *** Bathrooms: 2.5 *** Size (sq ft): 1800 *** Pets Allowed: No *** Lease Length: one-year,"✨ FOR RENT: Beautiful 3 Bedroom Apartment – Prime Location ✨ Looking for a spacious and comfortable place to call home? This 3-bedroom, 2.5-bath apartment offers the perfect mix of convenience, ..."
Furnished Bedroom for Rent – Churchill Park Area,https://www.kijiji.ca/v-apartments-condos/st-johns/furnished-bedroom-for-rent-churchill-park-area/1732741207,"St. John&apos;s, NL A1B 2W8",47.576183158707,-52.726860145445,$1000,Bedrooms: 1 *** Bathrooms: 1 *** Size (sq ft): 1800 *** Pets Allowed: No *** Lease Length: one-year,"Furnished Bedroom for Rent – Churchill Park Area Move-in ready, fully furnished bedroom available in a quiet, well-maintained bungalow located in the Churchill Park area, close to MUN, the Health ..."
2 Bed 1 Bath Student Apartment,https://www.kijiji.ca/v-apartments-condos/st-johns/2-bed-1-bath-student-apartment/1732723652,"Lambe&apos;s Ln, St. John&apos;s, NL A1B",47.568629880352,-52.735633040278,$2010,Bedrooms: 2 *** Bathrooms: 1 *** Size (sq ft): 800 *** Pets Allowed: No *** Lease Length: one-year,"2 Bedroom Student Apartment for Sublet! Utilities and wifi included ! Hi! Looking for two students to take over our lease of a 2 bedroom, 1 bathroom, fully furnished apartment at Wester-land just ..."
1 bedroom apartment - pet friendly - in suite laundry,https://www.kijiji.ca/v-apartments-condos/st-johns/1-bedroom-apartment-pet-friendly-in-suite-laundry/1732696134,"40 Newtown Road, St. John&apos;s, NL",47.567755993254,-52.717927970326,$2100,Bedrooms: 1 *** Bathrooms: 1 *** Size (sq ft): 655 *** Pets Allowed: Yes *** Lease Length: one-year,"Modern Apartment for Rent – Prime Location! Looking for convenience, comfort, and style? We’ve got the perfect place for you! Located just steps from downtown, these beautiful apartments offer ..."
Apartment for rent,https://www.kijiji.ca/v-apartments-condos/st-johns/apartment-for-rent/1732636769,"St. John&apos;s, NL A1C 3X2",47.568721085586,-52.709329394954,$1500,Bedrooms: 1 *** Bathrooms: 1 *** Size (sq ft): 800 *** Pets Allowed: No *** Lease Length: one-year,"1 Bed 1 Bath - Apartment 26 Barnes Rd, St John&apos;s, NL A1C 3X2, Canada Unfurnished, upper floor, non smoking, one bedroom apartment available Feb. 1st, in the Rawlins Cross area(St. John&apos;s), (Barnes ..."
4+ Bedroom Main Floor Apartment,https://www.kijiji.ca/v-apartments-condos/st-johns/4-bedroom-main-floor-apartment/1732600885,"29 Halls Road, St. John&apos;s, NL",47.599637986906,-52.740346962931,$2450,Bedrooms: 4.5 *** Bathrooms: 2 *** Size (sq ft): 1900 *** Pets Allowed: Yes *** Lease Length: one-year,"29 Halls Road, St. John’s NL Spacious 4-Bedroom Home with Apartment Setup Available Immediately $2,450 POU | Long-Term Rental Welcome to 29 Halls Road, a versatile and spacious 4-bedroom, 2-bathroom ..."
Executive 3-Bedroom Home – Churchill Square,https://www.kijiji.ca/v-apartments-condos/st-johns/executive-3-bedroom-home-churchill-square/1732558281,"St. John&apos;s, NL A1B 1V9",47.580691574877,-52.719719685949,$2300,Bedrooms: 3 *** Bathrooms: 1.5 *** Size (sq ft): 1300 *** Pets Allowed: No *** Lease Length: one-year,"Availability: March 1 (Potential for earlier move-in) The Location Experience premium living in the heart of the Churchill Square area. Tucked away on a quiet street off Elizabeth Avenue, this home ..."
Room in 4 bedroom 3 bathroom house,https://www.kijiji.ca/v-apartments-condos/st-johns/room-in-4-bedroom-3-bathroom-house/1732548491,"Moss Heather Dr, St. John&apos;s, NL A1B 4R8",47.562215171252,-52.762958395372,$650,Bedrooms: 4 *** Bathrooms: 3 *** Size (sq ft): 25 *** Pets Allowed: Yes *** Lease Length: month-to-month,Room in 4 bedroom and 3 bathroom house.Pet friendly house.I need a tenant to rent a room immediately . The house is fully furnished. The room is on the second floor and overlooks the courtyard. The ...
House for Rent,https://www.kijiji.ca/v-apartments-condos/st-johns/house-for-rent/1732514538,"A1A, Canada",47.610517196,-52.725143035,$2190,Bedrooms: 4.5 *** Bathrooms: 1 *** Size (sq ft): 2000 *** Pets Allowed: No *** Lease Length: one-year,Description ✨ Details: • Lease required (5 month minimal) • Damage deposit: 75% of rent • Utilities: POU (mainly electricity) • Bus stop nearby (very convenient) • Hwy is just 3 minutes driving • ...
"Brand New 2 Bedroom Apartments for Rent, Rivers Edge-Southlands",https://www.kijiji.ca/v-apartments-condos/st-johns/brand-new-2-bedroom-apartments-for-rent-rivers-edge-southlands/1732474535,"Cedar Hill Pl, St. John&apos;s, NL",47.60396373893,-52.749683530854,$2100,Bedrooms: 2 *** Bathrooms: 1 *** Size (sq ft): 1000 *** Pets Allowed: No *** Lease Length: one-year,"Be the first to live in this brand new build 2 bedroom, 1 bathroom condo-style apartment located in the desirable Cedar Hill Place, Rivers Edge-Southlands. Featuring all new appliances and a ..."
Safe secure condo in 50 plus building east end,https://www.kijiji.ca/v-apartments-condos/st-johns/safe-secure-condo-in-50-plus-building-east-end/1732403125,"St. John&apos;s, NL A1A 4B7",47.586923058884,-52.711995091621,$1600,Bedrooms: 2 *** Bathrooms: 2 *** Size (sq ft): 1200 *** Pets Allowed: No *** Lease Length: one-year,"Available February 1. Two bedroom, two bathroom condo in 50 plus building located at 7 Tiffany on Tiffany Lane. Safe, secure building off Mount Cashel Road. $1600 per month. POU. Contact to view."
4 Beds 2 Baths Townhouse near Village Mall,https://www.kijiji.ca/v-apartments-condos/st-johns/4-beds-2-baths-townhouse-near-village-mall/1732338472,"St. John&apos;s, NL A1E 3Z6",47.535558840044,-52.755306648442,$2000,Bedrooms: 4 *** Bathrooms: 2 *** Size (sq ft): 1500 *** Pets Allowed: No *** Lease Length: one-year,"Looking for a comfortable, energy-efficient home that’s been thoughtfully updated? This end-unit townhouse will be available for rent on March 1st 2026 and offers plenty of space and modern ..."
Great location down town home,https://www.kijiji.ca/v-apartments-condos/st-johns/great-location-down-town-home/1732260615,"19 Gear St, St. John&apos;s, NL A1C 2J3",47.562035009061,-52.717665030024,$1950,Bedrooms: 3 *** Bathrooms: 1 *** Size (sq ft): 900 *** Pets Allowed: Yes *** Lease Length: one-year,"Great location on a downtown cul-de-sac. 5 min walk from mile one. 3 bedroom one bathroom, thoughtfully appointed and freshly painted. This house needs to be seen to be fully appreciated . Applicants ..."
3-BEDROOM NEW HOME FOR RENT,https://www.kijiji.ca/v-apartments-condos/st-johns/3-bedroom-new-home-for-rent/1732259475,"33 Gallants Street, Paradise, NL",47.541708189575,-52.88279371238,$2050,Bedrooms: 3 *** Bathrooms: 1.5 *** Size (sq ft): 1125 *** Pets Allowed: Yes *** Lease Length: one-year,NEW COZY 3-BEDROOM WITH 2-UP AND 1-DOWN LAYOUT. BEDROOM ON LOWER LEVEL HAS ITS OWN 2-PIECE WASHROOM FOR COMPLETE PRIVACY. LOCATED IN A NEW UPSCALE NEIGHBORHOOD OVERLOOKING ADAM&apos;S POND. CLOSE TO ...
St. John&apos;s Condo for Rent,https://www.kijiji.ca/v-apartments-condos/st-johns/st-johns-condo-for-rent/1732252073,"St. John&apos;s, NL A1A 2B4",47.590723413783,-52.700103182672,$2000,Bedrooms: 2 *** Bathrooms: 1.5 *** Size (sq ft): 1000 *** Pets Allowed: No *** Lease Length: one-year,"St. Johns East Near the Airport, Confederation building, MUN, and Stavanger Drive shops 2 bedrooms Hardwood floors Large windows Parking lot close to building"
Private room for rent ,https://www.kijiji.ca/v-apartments-condos/st-johns/private-room-for-rent/1732230403,"Cumberland Crescent, St. John&apos;s, NL A1B 3M4",47.564865083198,-52.758468980707,$700,Bedrooms: 3 *** Bathrooms: 2 *** Size (sq ft): 1 *** Pets Allowed: No *** Lease Length: month-to-month,"$700+ POU | Furnished Master Bedroom w/ Private Bath Fully furnished house available in a three-bedroom home with basement. Includes heat, light, internet, laundry, parking, and shared access to full ..."
1 bedroom Apartment for Rent,https://www.kijiji.ca/v-apartments-condos/st-johns/1-bedroom-apartment-for-rent/1732088497,"Conception Bay South, NL A1X 0K9",47.479609720167,-53.050552649913,$1275,Bedrooms: 1 *** Bathrooms: 1 *** Size (sq ft): 1000 *** Pets Allowed: No *** Lease Length: one-year,"Brand new build 1-bedroom apartment located above ground. This bright unit features an open-concept kitchen and living room, all new stainless steel appliances, large bedroom with ample space, full ..."
Room for rent,https://www.kijiji.ca/v-apartments-condos/st-johns/room-for-rent/1732079272,"22 Smith Ave, St. John&apos;s, NL A1C 5E9",47.557804997804,-52.728817990389,$600,Bedrooms: 1 *** Bathrooms: 2.5 *** Size (sq ft): 250 *** Pets Allowed: No *** Lease Length: month-to-month,"Room for Rent – Available February A private room is available for rent starting February. The home is quiet, bright, and well maintained, making it ideal for a student. Rent: $600/month (everything ..."
1 Bedroom / 1 Bathroom Apartment – Utilities Included,https://www.kijiji.ca/v-apartments-condos/st-johns/1-bedroom-1-bathroom-apartment-utilities-included/1732037159,"St. John&apos;s, NL A1B 3H2",47.568549256571,-52.746587792759,$1600,Bedrooms: 1 *** Bathrooms: 1 *** Size (sq ft): 900 *** Pets Allowed: No *** Lease Length: month-to-month,"Registered 1-bedroom apartment Private entrance, located in a highly convenient and central area. This above-ground unit has been newly renovated and has never been lived in since renovation. Heat, ..."
Ocean view home for rent in CBS,https://www.kijiji.ca/v-apartments-condos/st-johns/ocean-view-home-for-rent-in-cbs/1729117386,"Lander Estates, Conception Bay South, NL A1X",47.498477261344,-53.026963307478,$2500,Bedrooms: 3 *** Bathrooms: 2 *** Size (sq ft): 2000 *** Pets Allowed: No *** Lease Length: one-year,"Beautiful 3 bedroom 2 bathroom house for rent in cbs. Close to all amenities, schools and shopping centres. Beautiful walking trail just in front of house. House has been completed renovated. Fenced ..."
2 Bed 2 Bath Apartment,https://www.kijiji.ca/v-apartments-condos/st-johns/2-bed-2-bath-apartment/1731992397,"460 Empire Ave, St. John&apos;s, A1E 1W8",47.553108994641,-52.745618006562,$1800,Bedrooms: 2 *** Bathrooms: 2 *** Size (sq ft): 1200 *** Pets Allowed: Yes *** Lease Length: one-year,"Upper Level of House available for Rent, move in ready. 2 Bedrooms 2 Full Bathroom open concept .Fairly New Subdivision in Seal Cove only 20 minutes from Costco 25 minutes to Downtown. Rent $1850.00 ..."
2 Bedroom Executive Condo For Rent,https://www.kijiji.ca/v-apartments-condos/st-johns/2-bedroom-executive-condo-for-rent/1731992364,"St. John&apos;s, NL A1C 3B5",47.564144482633,-52.729146560994,$2500,Bedrooms: 2 *** Bathrooms: 1.5 *** Size (sq ft): 1200 *** Pets Allowed: No *** Lease Length: one-year,*Available March 15th; possibly as early as March 1st* 1 Year lease required. Beautiful 2 bedroom condo in centre city. It&apos;s located just minutes away (within walking distance) from the hospital and ...
Brand new 3 bedroom apartment for rent!!!,https://www.kijiji.ca/v-apartments-condos/st-johns/brand-new-3-bedroom-apartment-for-rent/1731941496,"Tigress St, St. John&apos;s, NL A1B 0L6",47.555802650205,-52.801616970343,$2300,Bedrooms: 3 *** Bathrooms: 2.5 *** Size (sq ft): 2200 *** Pets Allowed: No *** Lease Length: one-year,FOR RENT ‼️ – Ultra modern 2 storey 3-bedroom Apartment in Kenmount Terrace Available NOW ‼️ ✅ Bright and open concept living room and ✅HVAC and mini split system for energy efficiency. ✅ Big fully ...
Short Term/Long Term Rentals,https://www.kijiji.ca/v-apartments-condos/st-johns/short-term-long-term-rentals/1666735630,"Higgins Line, St. John&apos;s, NL",47.595267997866,-52.726335019211,$1475,Bedrooms: 0 *** Bathrooms: 1 *** Size (sq ft): 400 *** Pets Allowed: No *** Lease Length: one-year,Contact us directly for more information. info@latitudelivingstjohns.ca Visit https://latitudelivingstjohns.ca/ for application process. Find Your Perfect Fit at Latitude Living: Fully Furnished ...
"FOR RENT – 4 Bedroom Apartment | St. John’s, NL",https://www.kijiji.ca/v-apartments-condos/st-johns/for-rent-4-bedroom-apartment-st-john-s-nl/1731775038,"Suvla St, St. John&apos;s, NL A1C 4Z2",47.565522260613,-52.727367420167,$2600,Bedrooms: 4 *** Bathrooms: 1 *** Size (sq ft): 2000 *** Pets Allowed: No *** Lease Length: one-year,"Spacious 4-bedroom, 1-bathroom apartment located in a great central area of St. John’s, close to bus routes, Memorial University, and downtown. This unit has been freshly painted and features all new ..."
3 bedroom apartment for rent ,https://www.kijiji.ca/v-apartments-condos/st-johns/3-bedroom-apartment-for-rent/1731706875,"Paradise, NL, A1L 2W7",47.543084447991,-52.875653259864,$2000,Bedrooms: 3 *** Bathrooms: 2 *** Size (sq ft): 1200 *** Pets Allowed: No *** Lease Length: month-to-month,I am renting out a 3-bedroom apartment that features a spacious layout perfect for families or roommates. The apartment is in great condition and ready for move-in. It includes essential appliances ...
3 Beds 1 Bath Home,https://www.kijiji.ca/v-apartments-condos/st-johns/3-beds-1-bath-home/1731702038,"St. John&apos;s, NL A1E 4H3",47.536023868032,-52.757068189214,$2000,Bedrooms: 3 *** Bathrooms: 1 *** Size (sq ft): 1100 *** Pets Allowed: No *** Lease Length: month-to-month,"Modern 3-Bedroom Main Unit for Rent – 21 Canada Drive, St. John’s Available February 1st | $2,000/month + Utilities | No Pets | No Smokingy Looking for a bright, newly updated space to call home? ..."
"Nice home in nice neighborhood, 4+bedrm",https://www.kijiji.ca/v-apartments-condos/st-johns/nice-home-in-nice-neighborhood-4-bedrm/1725569048,"St. John&apos;s, NL A1A 2M4",47.597930718957,-52.705353020088,$2190,Bedrooms: 4.5 *** Bathrooms: 1 *** Size (sq ft): 2100 *** Pets Allowed: No *** Lease Length: month-to-month,"Nice home in decent neighborhood, with 4 bedrooms, large living room, bath/kitchen/dining room, plus beautiful deck, green yard and spacious basement for storage/recreation! Great Location: Quiet ..."
Room for Rent,https://www.kijiji.ca/v-apartments-condos/st-johns/room-for-rent/1731656040,"NL-60, Holyrood, A0A 2R0",47.395521161429,-53.119606165246,$750,Bedrooms: 2 *** Bathrooms: 1 *** Size (sq ft): 800 *** Pets Allowed: No *** Lease Length: month-to-month,Furnished room for rent in a beautiful modern 55+ Seniors Condo in Holyrood. I&apos;m looking for a clean and tidy person to share my two bedroom apartment. I am a non smoking professional with a healthy ...
Bright &amp; Modern 3-Bedroom House for Rent,https://www.kijiji.ca/v-apartments-condos/st-johns/bright-modern-3-bedroom-house-for-rent/1731646605,"St. John&apos;s, NL A1B 5E1",47.565724974296,-52.770733876513,$2200,Bedrooms: 3.5 *** Bathrooms: 2.5 *** Size (sq ft): 1300 *** Pets Allowed: No *** Lease Length: one-year,Bright and modern 3-bedroom house with 2.5 bathrooms available for rent. The primary bedroom features a private ensuite bathroom. The house comes fully equipped with: Washer &amp; dryer Dishwasher ...
MARYSTOWN - 1 Bedroom Basement Apartment,https://www.kijiji.ca/v-apartments-condos/st-johns/marystown-1-bedroom-basement-apartment/1720563342,"Marystown, NL A0E 2M0",47.186928874434,-55.141100722896,$1000,Bedrooms: 1 *** Bathrooms: 1 *** Size (sq ft): 800 *** Pets Allowed: No *** Lease Length: month-to-month,"1 bedroom basement apartment available for rent in Marystown. Please note: this apartment is not in or near St. John&apos;s. Fully furnished, heat, light, cable and Internet included. Available for a ..."
A room for Rent,https://www.kijiji.ca/v-apartments-condos/st-johns/a-room-for-rent/1731435073,"50 Gil Eannes Drive, St. John&apos;s, NL A1B 5C4",47.546531002757,-52.793456964564,$580,Bedrooms: 4.5 *** Bathrooms: 2 *** Size (sq ft): 2500 *** Pets Allowed: No *** Lease Length: one-year,Room for Rent – Kenmount Terrace 1 bedroom in a 5-bedroom house. ✔free internet ✔ Private toilet ✔ Private living area (TV &amp; couch) ✔ Shared kitchen &amp; bathroom Kenmount Terrace 3 minutes to bus stop ...
Room for Rent – $650/month (All Utilities Included),https://www.kijiji.ca/v-apartments-condos/st-johns/room-for-rent-650-month-all-utilities-included/1731432945,"St. John&apos;s, NL A1C 4P5, Canada",47.564306169545,-52.720429884605,$650,Bedrooms: 1 *** Bathrooms: 2 *** Size (sq ft): 1900 *** Pets Allowed: No *** Lease Length: one-year,"Room for Rent – $650/month (All Utilities Included) Furnished single room available for rent in a great location! Just $650/month, all utilities included. ✨ Features: Fully furnished with bed, desk, ..."
